문장,성소수자,인종국적,연령,지역,종교,기타혐오,악플욕설,clean,개인지칭,성별
동성애= 에이즈 라는 화면을 대문짝만 하게 걸어두고 마치 공정한척 하는군요. 그냥 솔직하게 동성애 반대라고 적지 난 님같은 부류보면 항상 질문하고 싶은게 그럼 여성간의 동성애는 에이즈 안걸리니 괜찬은 건가요? 남자 동성애라도 콘돔끼고 성관계하면 괜찬겟네요?,1,0,0,0,0,0,0,0,0,0
오늘 아들감은 이거다 깔깔깔,0,0,0,0,0,0,1,0,0,0
무슨 수익률을 1년가지고만 하냐 ㅋㅋㅋㅋ최소 10년은 봐야지,0,0,0,0,0,0,0,1,0,0
곧 여름이라 이런 소설도 생각해보노. 증거불충분으로 사전종결되거나,0,0,0,0,0,0,0,1,0,0
자국 내 싫다고 하는 사람들은 소수민족일 가능성이 높다,0,1,0,0,0,0,0,0,0,0
ㅇㅇ이거맞음 유명한 띵문중에 앵나 장문의 글있잖노 여러 커뮤들 멋글 모아놓은거 제목이 앵나 띵문인데 말할 방법이 없네 뭐 이런거였나 그랬노 그거보면 진심 이건 과학임 인류 모든 거 다 설명가능,0,0,0,0,0,0,0,1,0,0
어그로 ㅂㅅㅌㅊ 노 다녀왔다이기,0,0,0,0,0,0,1,0,0,0
이자스민 그렇게 좋아하는 필리핀으로 도로 보내자추방ㄱㄱ,0,1,0,0,0,0,0,0,1,0
이슬람과 무슬림으로 인한 문제점만 보지 마시고 왜 그들이 이슬람을 믿고 사는지 한 번 알아보는 것도 좋을듯 합니다 제 생각엔 분명 뭔가가 있습니다 교회나 성당가고 절에 다니는 사람들처럼 그들에게도 이슬람이 뭔가 의미 있기에 믿겠죠,0,0,0,0,0,0,0,1,0,0
그저 말 잘듣는 일본따까리 나라 아니냐?저런 반일을 부추기는 조선놈들 선동을 조심해야함,0,1,0,0,0,0,0,0,0,0
팩트는 그런년들 먹을려고 하는거임 연애목적이아니다,0,0,0,0,0,0,0,0,0,1
하느님께서는 애초에 성 소수자를 만들지않으셨다. 어쩌다가 세상이 돌연변이가 대우받는 세상이되었는지 개탄스럽다.,1,0,0,0,0,0,0,0,0,0
메갈들이 쓸모가 있노?이기,0,0,0,0,0,0,0,0,0,1
개 꼴 씨발 ㅋㅋㅋㅋ,0,0,0,0,0,0,1,0,0,0
저항군?저항군의 대빵은 역시 존코너 인가?,0,0,0,0,0,0,0,1,0,0
나는 화장이건 일자눈썹이건 테니스스커트건 코르셋못버린련들한텐 아무감정없는데 코르셋이 코르셋이란걸 모르거나 부인하는 련들보면 답답하고 앵나 지친다 나도 옛날에 ^자기만족^무새짓했던거 생각나고 좆팔,0,0,0,0,0,0,0,0,0,1
사스가 홍통일체. 그런데 저런거는 쌍도사는 홍어일 확률이 높다이기. 통통따아아아리~~~통통따,0,0,0,1,0,0,0,0,0,0
010 **** **** `갑자기 전화해서 욕하고 패드립하는 새끼입니다 형님들 도와주세요,0,0,0,0,0,0,0,1,0,0
데모하다 감옥가서 군대 안간 운동권 틀딱이 이런 댓글 쓴다고 생각하면 소오름,0,0,1,0,0,0,0,0,0,0
서울시 교육청 학생인권 종합계획 재고해 주세요.,0,0,0,0,0,0,0,1,0,0
"하나님께서 선한 길로 인도하셔서, 꼭 교회가 한목소리를 내면서 사람들의 영적 갈급함을 채워주는 공동체가 되길 소망합니다.",0,0,0,0,0,0,0,1,0,0
있었던 사실 그대로 말 하는게 그리도 힘든건가? 그 사실이란게 쉽게 발설할 수 있는게 아니라서?,0,0,0,0,0,0,0,1,0,0
사람들이 좋아하면 흥할테고 아니면 안되겠지. 과연,0,0,0,0,0,0,0,1,0,0
내용도 더럽고 그림체도 더럽고 뭔소리 하는건지 모르겠고 출처도 시벌 일베 애비잖아? 갑자기 끝에 중국은 왜 쳐맞냐? 이걸 진짜라고 믿다니,0,0,0,0,0,0,1,0,0,0
아따 우덜은 우덜식 복장이 있당께,0,0,0,0,0,0,0,1,0,0
그땐 길거리에서 신용카드 발급해줌성인이라면 몇장이든 누구나 다 가질 수 있었음,0,0,0,0,0,0,0,1,0,0
"쒸익쒸익,,",0,0,0,0,0,0,0,1,0,0
사전 오프모임은 할 필요도 없고,0,0,0,0,0,0,0,1,0,0
콘돔썻어야지,0,0,0,0,0,0,0,1,0,0
역시 7시다 따 묵 고다 니 네 ?,0,0,0,1,0,0,0,0,0,0
오늘은 웨더가 클리치 한게 아니라 로건이 계속 클린치함.오히려 3라운드부터 가드 올리고 인파이팅 하려고 들어가더만,0,0,0,0,0,0,0,1,0,0
애 불쌍하네 없던 남혐도 생기겠노... 한남이 똥송합니다,0,1,0,0,0,0,0,0,0,1
공공의 이익이 뭔지 모르는 집단,0,0,0,0,0,0,1,0,0,0
니가 뮤슨 권리로 저 틀딱을 심판하냐 ?좆 찐따새끼가 ㅋㅋ,0,0,1,0,0,0,0,0,0,0
"그래 우파는 너무 솔직해서 문제고 좌는 반대라 문제지,흥미로운데",0,0,0,0,0,0,0,1,0,0
구상권 무조권 청구,0,0,0,0,0,0,0,1,0,0
오영훈 얘도 어디 메갈이나 오유같은 사이트에서 자료 긁어온 거야?이 정부 진짜 어디까지 갈려나...?,0,0,0,0,0,0,0,1,0,0
자지들은 그래봐야 글을 못읽노,0,0,0,0,0,0,0,0,0,1
부모는 자식의 거울이다 훌륭한 부모님께 사랑 많이 받고 자라서인지 자존감이 월등하군요 30호님 매력이 넘쳐요 팬 됐쓰요,0,0,0,0,0,0,0,1,0,0
7개월이면 한창 이쁜짓할때인데ㅠ 임신우울증 핑계다 자신의 배아파 낳은 자식인데 어떻게 그럴수가 있나,0,0,0,0,0,0,0,1,0,0
(진지) 진짜 그 뜻이였노;,0,0,0,0,0,0,0,1,0,0
130403 입소했는데 플랜카드 만들어서 흔들다가 소인사장교한테끌려가서 퇴소당할뻔했다,0,0,0,0,0,0,0,1,0,0
희안하게 눈과 누썹사이가 어마어마하게 넓네,0,0,0,0,0,0,0,1,0,0
"교회 건축헌금하라고 한 시간 내내 설교하는 목사들아 보고 좀 배워라~ 교회 커지고, 신도수 늘어 커지면 자식 물려줄 생각만 하지 말고",0,0,0,0,1,0,0,0,0,0
원하는대로 행동하네,0,0,0,0,0,0,0,1,0,0
이미 늦음니 늘그막에 옆에 이사온 애 이름이 얄랑발랑 ㄹㅇ,0,0,0,0,0,0,0,1,0,0
ㅈㄴ 역겹네 ㅆㅂㅋ ㅋ,0,0,0,0,0,0,1,0,0,0
알아서 붕괴되는구만,0,0,0,0,0,0,0,1,0,0
마 ! 센틈시티는 안쓰나?,0,0,0,0,0,0,0,1,0,0
사이언슼ㅋㅋㅋ,0,0,0,0,0,0,0,1,0,0
아웅산수치 지지한다. 개슬람은 죽여도돼~로힝야 고투헬.,0,1,0,0,1,0,0,0,0,0
나련도 사회전체를 분해해서 생각하는 것에 익숙했는데,0,0,0,0,0,0,0,1,0,0
용의자를 저렇게 사진으로 올려도 되는거냐 확정된거도 아닌대,0,0,0,0,0,0,0,1,0,0
시발 진짜 다문화에 관해서는 여야가 따로없고 남녀가 구분없네저건 이자스민없다고 다문화법안이 발의안될거라는건 순진한 생각이다 진짜,0,0,0,0,0,0,1,0,0,0
"이거 그린라이트 맞죠?"" (쿠움척) 응 아니야 ^^",0,0,0,0,0,0,1,0,0,0
인권이라는 가면 뒤에 다수를 차별하고 갈등을 초래하는 차별금지법안 철회를 강력히 요구합니다,1,0,0,0,0,0,0,0,0,0
미향스런목사네..,0,0,0,0,0,0,0,1,0,0
이게 기독교 현실,0,0,0,0,0,0,0,1,0,0
장미칼 미만잡,0,0,0,0,0,0,0,1,0,0
ㅋㅋㅋㅋㅋㅋㅋㅋㅋㅋㅋ 존내 통쾌하노 ㅋ,0,0,0,0,0,0,0,1,0,0
왜 피내사자인건지.. 이럴땐 법이 너무 물렁한데,0,0,0,0,0,0,0,1,0,0
대통령잘만나서다들지할말하고들산다 알기나아는지,0,0,0,0,0,0,0,1,0,0
저 자리 가기엔 너무 젊은데시장은 미어터지게 좁고 통번대 출신은 예전보다 많은데 1세대가 아직도 현역이라 교수 연줄 아니면 절대로 못 간다어디 얼굴 좀 비출 정도면 채소 40대 후반이 보통임,0,0,0,0,0,0,0,1,0,0
아나운서 이쁘다 좆나 매력적이네,0,0,0,0,0,0,0,1,0,0
블리자들 급식충실력보다 ㅋㅋ 피방왔는데 컴텨랑 장비보고 지려겠구만,0,0,1,0,0,0,0,0,0,0
하얗고 남리남리한 남자 좋아했다 근데 그런 냄져들이 초중학교때는 있더니 그 이후로 증발했는지 없노,0,0,0,0,0,0,0,0,0,1
군대도 한남이 가서 으쩔수없는거노? 눈갱이다 이기,0,0,0,0,0,0,0,0,0,1
한남은 어쩔수가 없노 남페미는 무슨 그저 씨부랄놈이노 깔깔깔,0,0,0,0,0,0,0,0,0,1
메갈년이 씨발 어떻게 여자냐?? ==> 메갈년이 씨발 어떻게 사람이냐??메갈년은 생물학적으로만 여자다 ==> 메갈년은 생물학적으로만 사람이다착한 성평등,0,0,0,0,0,0,0,0,0,1
의원님 응원합니다!!,0,0,0,0,0,0,0,1,0,0
동성애 옹호해주는 서구권은 게이가 여자화장실 와도 아무말 못한다고 합니다. 어이가 없죠. 에이즈온상 동성애는 사회에서 격리시켜야 합니닷,1,0,0,0,0,0,0,0,0,0
우리나라 점점 비정상적인게 정상이되는거 같아 무서워질라 그래,0,0,0,0,0,0,0,1,0,0
흠~~~모든건 지나 가는 법 멈춰 있지 않는다 제발 내년 은 평화 로운 일상 이 되길,0,0,0,0,0,0,0,1,0,0
으 그 쟈근 좆을 왜 빠노..정 좆을 못잃으면 차라리 양남을 먹어라 콜셋들아..돈 들고 시간 들여 정성을 다 해 업업하고 그 피지컬과 왁구를 상대하면 현타안오노..?,0,1,0,0,0,0,0,0,0,1
짤 슴가가 허리에달렷냐 왤케 쳐짐,0,0,0,0,0,0,0,0,0,1
공무원이 국민세금 쳐먹고 근무이탈 직무유기 아니냐 저거 신고 가능하냐?,0,0,0,0,0,0,0,1,0,0
이대만 아니었으면....,0,0,0,0,0,0,0,1,0,0
너 여권보여달라고 했으면 좆될뻔했네,0,0,0,0,0,0,1,0,0,0
차별금지법 반대합니다!,0,0,0,0,0,1,0,0,0,0
부산 동쪽에 뭐있냐? ㅋㅋㅋㅋㅋ,0,0,0,0,0,0,0,1,0,0
이거 양국에도 비슷한거 있지 않노? 중고딩때 이모키드 비슷한거 말미노 일부러 쎄보이려고 이미 임상효과 전무라 실패한 유행을 주워와다가 신신 거리고 미개하다 미개해,0,0,0,0,0,0,0,1,0,0
우리에게는 유모차 부대가 있는데?,0,0,0,0,0,0,0,1,0,0
민주화수 시발 ㅋ,0,0,0,0,0,0,1,0,0,0
이런 게 바로 국격! 칭찬할 건 칭찬하자 아무리 밉더라도,0,0,0,0,0,0,0,1,0,0
웃길려고 한거가튼데,0,0,0,0,0,0,0,1,0,0
ㅋㅋㅋ 주작글 같긴 한데 도와줬어야 드립치는 새끼들 존나 좆같네 ㅋ,0,0,0,0,0,0,1,0,0,0
목사 떠나서 한국인으로썬 저렇게 분노하는건 당연할것같은데.. 뭔가 내가 생각한 반응하고 다르네,0,0,0,0,0,0,0,1,0,0
돌아가신 울 아부지 생각나네.....,0,0,0,0,0,0,0,1,0,0
또라이 만난적 있었는데 내가 더 또라이였음 ㅋㅋㅋㅋㅋㅋ 머피소 낫꿘때매 한창 낫들고 다니던 시기였다이기.. (먼산),0,0,0,0,0,0,1,0,0,0
그냥 일베하는 척만 하는 애들이잖아,0,0,0,0,0,0,0,1,0,0
검찰 개혁 반대자!!!,0,0,0,0,0,0,0,1,0,0
보토피아 완성할려면 우리도 해야한다 이기,0,0,0,0,0,0,1,0,0,0
좆나 냄새나는 조선족 OUT ^^,0,1,0,0,0,0,0,0,0,0
falling plates 사람,0,0,0,0,0,0,0,1,0,0
AICPA 따고 넘어갔나보네,0,0,0,0,0,0,0,1,0,0
공감합니다. 정부와 여당만 비판하기엔 야당들 역시 대안이 되지 못하며 비슷한 스탠스라고 봅니다. 정부의 그러한 정책을 비판하는 정당 하나 없구요.,0,0,0,0,0,0,0,1,0,0
추천요정 나한테 추천을 줘~~~~~````,0,0,0,0,0,0,0,1,0,0
찝접은 니 밥먹는 소리냐 깔깔깔,0,0,0,0,0,0,1,0,0,0
그동안 2000년대에 핸드폰이 작았던건 여자에게 맞춰져있기 때문이었군요. 난 액정기술이 발달하지 못해서인줄 알았는데 그런 비밀이,0,0,0,0,0,0,0,1,0,0
병신들 이순신도 충남 아산 출신이다 어휴 라도수준하곤,0,0,0,1,0,0,0,0,0,0
출소해서 저교회 나가면 되겠네 학생부나 유년부 교사로 거듭나시길 바랍니다 조형재님 아니 조집사님,0,0,0,0,1,0,0,0,1,0
꼬북칩 챙겼냐?,0,0,0,0,0,0,0,1,0,0
십계명 모르노?,0,0,0,0,0,0,0,1,0,0
저 단체는 미투운동이 계속될수록 한국남자들이 펜스룰을 적용해 일본남자들이 초식화 되는것처럼 한국남자들도 여자들을 거들떠보지않을까 걱정되어서 그런거같다.,0,0,0,0,0,0,0,1,0,0
내가 아이돌 이름 잘안외우는데 ㅋㅋㅋㅋ 올ㅋㅋㅋ 것보다 밑에 댓글 저정도면 분탕종자 아니냐 걍 ㅋㅋ,0,0,0,0,0,0,0,1,0,0
이미 서로 의심중,0,0,0,0,0,0,0,1,0,0
sos글 링크좀,0,0,0,0,0,0,0,1,0,0
와 참예술가련이노 감탄나온다 이기 ㅇㅊ박고가노,0,0,0,0,0,0,0,1,0,0
수지 닮았다는게 주작마재윤 방송에 수지 금지어 채택,0,0,0,0,0,0,0,1,0,0
"문재인, 정경두. 이런자가 있으니 이런 막 장.추잡한 사건이 현실 이다. 나라 꼴 우수워 지는구나. 선거로 바꾸기전 이꼴은 계속된다.",0,0,0,0,0,0,1,0,1,0
짱깨들 욕할 거 하나 없네...,0,1,0,0,0,0,0,0,0,0
해적왕!!!,0,0,0,0,0,0,0,1,0,0
하여튼 개독새끼들은 우루루 몰려가서 깽판치는거는 알아줘야돼,0,0,0,0,1,0,0,0,0,0
남자에게 능력을 갖추라고 하는것이나 여자에게 예뻐지기 위해 노력하라는거나! 재밌게 살기 위해서는 둘다 맞는 말임,0,0,0,0,0,0,0,0,0,1
분탕 좆족 정모하는글이노 ㅎㅎ,0,1,0,0,0,0,0,0,0,0
턴 언데드! 홀리라이트!,0,0,0,0,0,0,0,1,0,0
나도 일단 가입!,0,0,0,0,0,0,0,1,0,0
국제통계결과 20대 한국남성 5명중 1명이 약 6한달에 네번9 성매매에 돈을 쓴다,0,0,0,0,0,0,0,1,0,0
점점 추해지는구나 ㅉㅉㅉ,0,0,0,0,0,0,0,1,0,0
중간에 분홍걸레 뒤집어쓴사람 누구냐자살충동만 느끼지말고 그냥 죽었으면 좋것다,0,0,0,0,0,0,1,0,0,0
임대아파트 들어가기 위한 마지막 수단이다.,0,0,0,0,0,0,0,1,0,0
9일당일오전외부에서들었다면그건아무상관없는거죠.여론몰이하지잉ㆍㄹ길,0,0,0,0,0,0,1,0,0,0
얼마나 혼자 힘들었을까 좋은곳으로 가시게나 젊은사람아 고생했네,0,0,0,0,0,0,0,1,0,0
아니 어디에 노인이 있노?,0,0,0,0,0,0,0,1,0,0
호박씨 까는거봐라 ㅋㅋㅋ,0,0,0,0,0,0,0,1,0,0
여자 가슴은 남자 가슴으로 비교해야짘ㅋㅋㅋㅋㅋㅋ 물론 냄져 여유충말고 근육가슴냄져ㅋㅋㅋㅋㅋㅋ 여자 가슴을 남자 꼬추로 비교하는거 한남좆처럼 미개,0,0,0,0,0,0,0,0,0,1
전라도 + 대깨문 + 짱깨 + 조선족은 죽여도 돼,0,1,0,1,0,0,0,0,0,0
나련 그래서 지금 스티커 24장 뽑아왔노 ㅋㅋ다시 보력 충전 됐노,0,0,0,0,0,0,0,1,0,0
존나 실감나네 ㅋㅋㅋㅋㅋㅋㅋㅋㅋㅋㅋㅋㅋㅋㅋㅋㅋㅋㅋㅋㅋㅋㅋㅋㅋㅋㅋㅋㅋㅋㅋㅋㅋㅋㅋㅋㅋㅋㅋㅋㅋㅋㅋㅋㅋㅋㅋㅋㅋㅋㅋ,0,0,0,0,0,0,0,1,0,0
그냥 유료버전 무료광고있는버전 두개 뽑아라이기야,0,0,0,0,0,0,0,1,0,0
팩트체크 좋습니다. 얼마나 많은 일베똥 메갈똥이 분노 증오 혐오를 조장하고 있는지 아주 심각합니다. 혐오 관련 알아야 할 만한 건 퍼오되 항상 팩트체크하고 감정에 휘둘리지 않도록 주의했으면 좋겠습니다.,0,0,0,0,0,1,0,0,0,0
뒤통수 삽으로 후린다음에 저 흙파서 그대로 묻고싶다,0,0,0,0,0,0,1,0,0,0
562련 좆나 개빻은 새끼를 다 만나느라 욕봤노. 천주교면 공평하게 낙태도 반대하고 똥꼬충도 혐오해야지 취사선택하는 건 또 무슨 애비뒤지는 개소리노? 똥꼬충도 꼴에 냄져라고 같은 냄져한테만 그 잘난 종교 배반해 가면서까지 선택적 공감능력 오지노.,0,0,0,0,1,0,0,0,0,1
엘리베이터 무섭다...안 탈 수도 없고,0,0,0,0,0,0,0,1,0,0
마지막 소추아니고 없추노. 저런 관상 보이면 아묻따 후장에 철근꽂아서 한강물에 재기시켜라 이기,0,0,0,0,0,0,0,0,0,1
인천 조폭들이 의리가 있더라.,0,0,0,0,0,0,0,1,0,0
가정이 무너지고~,0,0,0,0,0,0,0,1,0,0
그냥 병신같은놈이였지,0,0,0,0,0,0,1,0,0,0
그냥 지지하지 않는 것도 좋은 방법 같내요,0,0,0,0,0,0,0,1,0,0
22살 고졸게이 부모 도움 하나도 없이 3000 모았다 ㅁㅌㅊ?,0,0,0,0,0,0,0,1,0,0
초딩개학 최소한 1학기는 미뤄야할껄?!,0,0,0,0,0,0,0,1,0,0
저것봐라 저새끼들 난민 아니라니까ㅋㅋㅋㅋ 진짜 난민은 저새끼들이 전쟁터에 내버리고온 여자들이고 저것들은 난민가장한 먹버노 남의 나라와서 징징대지말고 니들 나라가서 니들이 똥싸논거나 치워라 좆팔,0,1,0,0,0,0,0,0,0,0
퀴어로 사는 것까지 말리진 못해도 그걸 가지고 이래라 저래라 하지는 말자,0,0,0,0,0,0,0,1,0,0
한국은 전라도한테 그렇게당해놓고도잘참는거보면호구나라가 분명!,0,0,0,1,0,0,0,0,0,0
평범하게 사는것도 쉬운게아니야. 게으르지않게 열심히살자. 오늘도 최선을다하자 게이들아.,0,0,0,0,0,0,0,1,0,0
인천은 강사새끼랑 개독교 새끼들때문에 코로나 천지네 둘이 손잡고 천국이든 지옥이든 꺼져라 좀,0,0,0,0,1,0,0,0,0,0
"소설을 써라 한낱 검사를 못 잊는 정치인 뿐,",0,0,0,0,0,0,0,1,0,0
여자애들 공가지고 축구하면됨 처음에야 에이~ 니가 하더라도 남자애 한둘 제끼고 강슛 날리면 바로 같이 놀아줌반면 남자가 여자하는거 끼어들면 여자들은 더 배타적으로 행동함 남자가 여자 영역에 들어가는게 얼마나 힘든지 저 선생은 알까?,0,0,0,0,0,0,0,0,0,1
이래서 내가 카스만 마신다,0,0,0,0,0,0,0,1,0,0
그런데 자주 피싱질 하지않지만 10년전에도 이수법을 쓰긴 했음 유행지난 수법 소규모업체에서 잡아서 게이까지 전화갔네,0,0,0,0,0,0,0,1,0,0
나도 볼거다 ㅋㅋㅋㅋ품평잼ㅋㅋㅋㅋ자적자구도 많이 나오길 기대해보겠노,0,0,0,0,0,0,0,0,0,1
특히 게이들이 에이즈가 많다는건 통계로 나왔다 그막대한 비용을 국민세금으로 지는데 그럼 이건 국민이 차별 받는거 아니냐?니들 사랑 때문에 피해보는 국민은 차별 아니냐고?이런건 말안하고 니들이 차별받는다고 말하지마라 차별이 아니라 니들 열등감이겠지,1,0,0,0,0,0,0,0,0,0
대한민국 김치녀들 보확찢 하는정의의 보확찢맨이 출동한다면?,0,0,0,0,0,0,0,0,0,1
한국년들 가격 개비싸고 갯수제한이니 뭐 안돼요 뭐 안돼요 몸파는 곳에서조차 존나 까다로움그리고 몸파는 것도 하기 싫어서 센슈얼이라는 딸딸방에 보지년들 존나 많음 ㅋㅋ그러나 중국여자는 한국년들보다 가리는 거 없음,0,1,0,0,0,0,0,0,0,1
난 약간 타격감 있었음. 맨날 한개만 사먹었는데 그거 보니까 여러개 먹어도 맛있나? 싶어서 두개 샀는데 두개 째는 맛없더라.,0,0,0,0,0,0,0,1,0,0
어차피 증명할 방법도 없으니 막던지네 ㅋㅋ 그냥 난민출신 흑인뚱녀 페미니스트라는 설정도 덧붙이지 그러냐 ㅋㅋ,0,1,0,0,0,0,0,0,0,1
걍 뭐 새로 그릴필요도 없이 저놈들 사진 쓰면 되겠노,0,0,0,0,0,0,0,1,0,0
한강이아니고 한바다네,0,0,0,0,0,0,0,1,0,0
선두. 대한민국 수많은 직종 중 가장 많은 범죄를 일으키 는 직종이 그 종교.,0,0,0,0,1,0,0,0,0,0
신박 좋아하시네 원래 로고가 저런데 씹병신 눈깔 삔놈아,0,0,0,0,0,0,1,0,0,0
자지에게 인간적으로 대해주면 안됨. 자지는 숨쉴한,0,0,0,0,0,0,0,0,0,1
구룡포 갔으면 적산가옥이나 한번 가보지 그랬냐,0,0,0,0,0,0,0,1,0,0
군대가 다시 나와야 할 때다... 민주화 당하는 것도 모자라서 똥꼬마저 내줘야하는 군대가 군대냐,1,0,0,0,0,0,0,0,0,0
하여튼 씨발 김치새끼들 인프라는 좆도안되면서 서구권에서 한다면 무턱대고 따라가요,0,1,0,0,0,0,0,0,0,0
"옛날 원로목사님들은 극보수인데, 전라도 출신 목사들이 전국에 퍼져서 요즘은 좌좀소굴임.",0,0,0,1,0,1,0,0,0,0
끊임없는 충돌지점을 만들어줘야한다고 생각하노. 그게 문이라고 생각한다 이기.,0,0,0,0,0,0,0,1,0,0
그래도 오케스트라 어느정도 클래스가 있는 공연이라 관객수준도 높아서 다행이었네...,0,0,0,0,0,0,0,1,0,0
천주교는 보통 때려도 참으니깐....,0,0,0,0,0,0,0,1,0,0
ESTA 신청해보세요 안되면 비자 신청하셔야할껍니다.,0,0,0,0,0,0,0,1,0,0
메퇘지가 코란 태우는거 항의 시위인가???,0,0,0,0,0,0,0,0,0,1
에이즈 만연한 아프리카 국가에서 콘돔 안끼는 흑좆들 때문에 골머리를 앓던 끝에 국가가 나서서 대규모 포경수술을 실시했는데 그 이후 에이즈 감염률이 뚝 떨어졌다는 연구도 있노. 좆밥이 성병균 드글거리는 온상이라는 증거,0,1,0,0,0,0,0,0,0,1
양좆도 참교육 해야하는데 한남옆에 있으니 노무 비교된다,0,1,0,0,0,0,0,0,0,1
"르꼬끄 반팔티랑, 데상트 맨투맨 당당하게 입고다님",0,0,0,0,0,0,0,1,0,0
뭐 어쩌라고 시발,0,0,0,0,0,0,1,0,0,0
전부터 노무 궁금했다.볼때마다 기괴하노,0,0,0,0,0,0,0,1,0,0
옥자환은 어떻게 착용하냐,0,0,0,0,0,0,0,1,0,0
그러니까 어쩌라고? 평등에 입각한 법을 만들든가.. 말은 누가 못해~~! 여성가족부 해체? 대학 장학금 남녀 똑같이? 국방의 의무? 말만 쳐 씨부리지 말고 행동해라.. 아니면 그냥 입만 나불대는 쓰래기다.,0,0,0,0,0,0,1,0,0,0
"작년에 유럽여행 다니면서 느낀게 이미 먹힘ㅋ ㅈ시골도 무슬림이 점령했다 독일, 영국 특히 프랑스ㅈ망",0,1,0,0,1,0,0,0,0,0
좆끼니진 비교 한남 양남,0,1,0,0,0,0,0,0,0,1
열심히공부해서 입사한사람들은 머니? 민노총 가입하고 들어가고싶은 회사앞에서 땡깡부리면다되는건가? 진짜 너무한다,0,0,0,0,0,1,0,0,0,0
다문화랑 대만 중국 싸움이랑 뭔상관이냐 개씨발 ㅋㅋㅋ빨대도 적당히 꽂아야지 애미뒤진 새끼들이이게 어떻게 인종탄압까지 나갈 수 있는거지?,0,1,0,0,0,0,0,0,0,0
"네, 다음 조선족!",0,1,0,0,0,0,0,0,0,0
부정탈때 소금 뿌린다 뿌린다고 가만있는 가마니냐,0,0,0,0,0,0,0,1,0,0
로마에 가면 로마법을 따르라고 했는 데..참..어이없다..,0,0,0,0,0,0,0,1,0,0
맘충들 국가내란죄로 언젠가는 다 잡아 처넣어야함,0,0,0,0,0,0,0,0,0,1
1914년,0,0,0,0,0,0,0,1,0,0
기혼자협횤ㅋㅋㅋㅋㅋㅋ,0,0,0,0,0,0,0,1,0,0
아직도 스위스 계좌 300조 찾고 있는 줄 아는 좌레기 달창 대깨문도 많구나 ㅉㅈ.. 조센족 새키들이길 바란다,0,1,0,0,0,0,0,0,0,0
왜저래......,0,0,0,0,0,0,0,1,0,0
흰가운보이가 제일가는 챙롬이노 특기는 냄저교수후장빨기다,0,0,0,0,0,0,0,0,0,1
아동학대범들 강력처벌 좀 하세요. 신상공개 홈페이지 만들어 신상공개 좀 합시다. 아이가 얼마나 외롭고 고통스럽게 갔을까요...,0,0,0,0,0,0,0,1,0,0
돈 되겠네,0,0,0,0,0,0,0,1,0,0
니들이 잘생기면 사람들이 이렇게까지 분노하진않았을꺼야,0,0,0,0,0,0,1,0,0,0
이제 시작이다 이기야 희희 기분딱좋노ㅋㅋㅋ,0,0,0,0,0,0,0,1,0,0
링크에 특수문자 붙여라이기,0,0,0,0,0,0,0,1,0,0
해머는 좀 빼지ㄷㄷㄷㄷㄷㄷ게이가 위험헐까봐 그러는거임1ㅂ,0,0,0,0,0,0,0,1,0,0
초딩 몇학년???점마들 9학년 까지 아니냐??,0,0,0,0,0,0,0,1,0,0
파랑 포장지가 봊나 맛있다 해바라기는 비추. 제일 손이 안가노. 빵만 먹지말고 다른 고기랑 야채 얹어서 먹어라이기 봊나 맛있다,0,0,0,0,0,0,0,1,0,0
자지는 역시 언제봐도 미개하게 생겼노 다컷팅하고 단체화형식 해버리고싶노,0,0,0,0,0,0,0,0,0,1
순간의 쾌락 때문에 일생을 망치게 되는 동성애입니다. 이런 사실들이 널리 알려져서 바른 길을 선택하게 되길 바랍니다,1,0,0,0,0,0,0,0,0,0
우리는 승리할 수 밖에 없노. 밑바닥에서 만나자.,0,0,0,0,0,0,0,1,0,0
핏물이 질질흐르는 사진은 입맛을 돋구는데 멀쩡한사진은 식욕재기하노,0,0,0,0,0,0,0,1,0,0
너는 아니지~ 왜그렇게 예민해 ㅋㅋㅋㅋ 웃챙,0,0,0,0,0,0,0,1,0,0
슨상님...점프당하시다,0,0,0,0,0,0,0,1,0,0
근데 누가 뚫어줬노..옆집 아저씨인가,0,0,0,0,0,0,0,1,0,0
저런거 못잡지 않나,0,0,0,0,0,0,0,1,0,0
어그로 워친련이노ㅋㅋㅋㅋㅋㅋ 좆이버 라이브보력간다이기,0,0,0,0,0,0,1,0,0,0
저 시절에 이미 본질을 깨달으신 분이네,0,0,0,0,0,0,0,1,0,0
이자스민 날이 갈수록 피부가 하얘지노국적 세탁중 ㅋㅋㅋ,0,1,0,0,0,0,0,0,1,0
답장으로 나 누구 아빤데 내일 학교에서 보자그러면 다신 안그럴텐데,0,0,0,0,0,0,0,1,0,0
제목 안바꾸세요?,0,0,0,0,0,0,0,1,0,0
고소 당하고 빨간줄 그어져도 정신슨리 할 수 있으려나?,0,0,0,0,0,0,0,1,0,0
우리나라에서도 하면 홍어들 잘만걸릴걸?홍어뿐만아니라 도벽증있는새끼들 다 걸릴듯존나 도둑질하고도 당당한새끼들이많아이런새끼들은 만천하에 얼굴팔려봐야정신차림,0,0,0,1,0,0,0,0,0,0
적어논 사업들 지금하고있다이기 월2천정도 벌고있노 역시 여자는 사업이 딱이노,0,0,0,0,0,0,0,1,0,0
"하이고,, 저런게 서울시장 3선쨰나 하고있나?ㅋㅋㅋㅋ서울시민수준보소",0,0,0,1,0,0,0,0,0,0
모이라는 왴ㅋㅋㅋ난 모이라 맘에 들던데.마귀할멈컨셉이라 좋음,0,0,0,0,0,0,0,1,0,0
잇이건 진짜 첨들어 본다 ㅋㅋㅋㅋㅋㅋㅋㅋㅋㅋㅋㅋㅋㅋㅋㅋ,0,0,0,0,0,0,0,1,0,0
광주에서는 조선족도 전라도스럽게 노네,0,1,0,1,0,0,0,0,0,0
ㅋㅋ 나라도 버린다 처음 일베에 광고할 땐 쓸데없이 욕만 하던 놈들이 이제 와서 ㅈㄹ들이노,0,0,0,0,0,0,1,0,0,0
난 정당현수막은 신고해도 안되는줄,0,0,0,0,0,0,0,1,0,0
통구이 프리존 경기북부 살아서 기분 딱 조타,0,0,0,1,0,0,0,0,0,0
오키나와 시발,0,0,0,0,0,0,1,0,0,0
나도 바이블은 찢어봤다 부산국제락페스티벌 데쓰메탈 밴드 Deicide공연중 팬중에 한분이 바이블 두쪽으로 찢어서 던지더라 그래서 주워들거 발기발기 찢어서 공중에 뿌렸지,0,0,0,0,0,0,0,1,0,0
병. 신.  육갑떤다에 한표!,0,0,0,0,0,0,1,0,0,0
