문장,성소수자,인종국적,연령,지역,종교,기타혐오,악플욕설,clean,개인지칭,성별
어차피 정지시켜도 또만들고 또만들고 유튜브로 돈안벌어도 투네이션으로 돈땡겨서 이제 정지시켜도 의미없는거같다,0,0,0,0,0,0,1,0,0,0
스키타이 스키잘타냐?,0,0,0,0,0,0,0,1,0,0
근데 이거 몇년된거 아님? 요즘 자료는 없노? 요즘 유럽 무슬림들 어떻게 됐는지 궁금하노.,0,0,0,0,0,0,0,1,0,0
앵나 적절하노ㅇㅇ,0,0,0,0,0,0,0,1,0,0
뜻을 생각해보면 어머니 본가라 하는 것도 나쁘진 않네. 남편에게는 아내는 집사람(집에 있는 사람)이고 자식한테 어머니 본가는 바깥에 있는 거라는 뜻이니까. 외가라는 말은 잘 모르고 그냥 쓰긴 했지만 바꾸는 게 좋다고 보여짐.,0,0,0,0,0,0,0,1,0,0
이슬람여자는 이슬람 남자한테만 결혼함.즉 넌 개슬람 된다는 뜻임,0,0,0,0,1,0,0,0,0,0
서로 항문냄새도 잘 아는 사이겠어..,1,0,0,0,0,0,0,0,0,0
앞섭에 아무것도 없는데 ㅋ부랄끼니도 올려쳐주는거다 이기 평면tv랑께,0,0,0,0,0,0,0,1,0,0
메이가 대충 보고 간 이유가 나왔네,0,0,0,0,0,0,0,1,0,0
깜둥이=홍어,0,1,0,1,0,0,0,0,0,0
이거 사진에 무슨 외계인 효과인가 그거 준거노? 아니면 원본이노 ?,0,0,0,0,0,0,0,1,0,0
체급 현실반영 오지노,0,0,0,0,0,0,0,1,0,0
이쯤 가면....막 하자는 거죠?,0,0,0,0,0,0,0,1,0,0
개가 수술받고 주민증 받을판이구만 아직까진 이른듯 반감이 더크다 대부분 다음생엔 여자든 남자든 태어나길 희망하지 않나?,1,0,0,0,0,0,0,0,0,0
서울사람이라고 하던데ㅡㅡ,0,0,0,0,0,0,0,1,0,0
"여군이 되고싶으면 복무중인 여군에 물어봐야하지않나? 성전환이나 동성애나 개취니까 상관없지만 남자가 성전환했다고 갑자기 나도 여자다!! 같이 생활하자하며 화장실,목욕탕 들어오고 옆에서 자면... 난 좀 그럴것 같다. 미안하다. 나도 그것까진 용납 못하겠다.",1,0,0,0,0,0,0,0,0,0
저짤 아줌매미가 내학자금이라 말했냐????만학임?,0,0,0,0,0,0,0,1,0,0
타임즈 떴다~! 글 보고 와라~,0,0,0,0,0,0,0,1,0,0
"게임하는년이라 정보먹버하러 릌리웹들어가는데 저기 좆놈들 페미스트 자체를 무서워하노 6페미옹호하면,,,김취메갈룐이야..,,쉬익..,9하고 맨날 염불외는 도퇘찐따새끼들이다이기야",0,0,0,0,0,0,0,0,0,1
또 금방 잡히겠네 ㅋㅋㅋㅋㅋㅋㅋ,0,0,0,0,0,0,0,1,0,0
문프발 5G 바이러스가 사실이었노 ㅋㅋㅋ,0,0,0,0,0,0,0,1,0,0
"뭐야 예림이, 쌍도야???",0,0,0,1,0,0,0,0,0,0
일반이들의 여혐 남혐 증가할수록동성애자들이 이득 봄.,1,0,0,0,0,0,0,0,0,0
갓경표 노오란리본 보소,0,0,0,0,0,0,0,1,0,0
조팔.. 짜장좆392. 지구가 좆같음을 다시 알려줘서 고맙다익이야. 보토피아만 살길이노,0,0,0,0,0,0,0,0,0,1
로버트하일!!,0,0,0,0,0,0,0,1,0,0
다른사람들 그렇게 죽여놓고도 무슬림 죽으니까 꼴에 또 열받나보네?,0,1,0,0,1,0,0,0,0,0
2만원주고 제사상도 채려주노? 가성비만 따지는 꽁치에 개복치노 나같으면 조상 좆도 못신다고 자괴감 들어서 할복한다 이기야,0,0,0,0,0,0,0,0,0,1
그래 이혼당하고 파토내고 분위기 싸하게 만들어라 아싸들아,0,0,0,0,0,0,1,0,0,0
진짜 티를 못내서 환장한듯 ㅋㅌㅋㅋㅋ,0,0,0,0,0,0,0,1,0,0
ㅋㅋㅋㅋㄱㅋㅇ웃챙이노,0,0,0,0,0,0,0,1,0,0
목사보다 그걸 믿고 따라하는 병-:신같은 신도들이 더 문제라고 봄,0,0,0,0,1,0,0,0,0,0
역시 냄져가 못벌면 보지대장이 푼돈에 집착하게 되노,0,0,0,0,0,0,0,0,0,1
ㅋㅋㅋㅋㅋ 직접 사용해보고 골라서 가져 가네.,0,0,0,0,0,0,0,1,0,0
페미니스트 여러분들 자신 있게 밝히자구요!!! 나는 페미니스트다!! 메갈이다!!! 워마드다!!!,0,0,0,0,0,0,0,0,0,1
영남대 씹지잡 ㅋㅋㅋㅋ,0,0,0,0,0,1,0,0,0,0
사리사욕의 성지 전라도,0,0,0,1,0,0,0,0,0,0
"불이라는건 벌을 뜻하는건데... 바리새, 서기관들이 하도 좆같이 굴어서 세상에 벌 준다는 뜻임. 그래서 예수가 내려오고 자기 믿으면 천국, 안믿으면 지옥(불)로 보낸다는 의미.. 즉 심판을 의미하는거다",0,0,0,0,0,0,1,0,0,0
성경을 읽고있기는 한데 그거달라고 간수들한테 행패부렸다는건 모르나부네 그냥 읽고있는건지 진짠지는 아무도모른다 착각질은그만,0,0,0,0,0,0,0,1,0,0
악의 침투를 막아라,0,0,0,0,0,0,0,1,0,0
후팔 워추 백만개 주고싶노,0,0,0,0,0,0,1,0,0,0
윾입파티하노? 언제적 성님성님같은 ㅎㅌㅊ워딩쓰고있노? 요즘 왜자꾸 뒤진 똥갈 불러오기해낸 분위기고 좆팔,0,0,0,0,0,0,1,0,0,0
자.업.자.득.,0,0,0,0,0,0,0,1,0,0
안치면서 치는 척 하는 의도가 뭐노? 이러면 뭐 얻는 게 있노?,0,0,0,0,0,0,0,1,0,0
부모라면 이때 학원 더 보내라,0,0,0,0,0,0,0,1,0,0
오옴이들 ㅇㅇ,0,0,0,0,0,0,0,1,0,0
타크비르 왜쳐라 타크비르,0,0,0,0,0,0,0,1,0,0
지금부터 일루미나티 사탄 숭배하면 나도 성공할 수 있는거냐??,0,0,0,0,0,0,0,1,0,0
꾸밀려니 힘들지,0,0,0,0,0,0,1,0,0,0
고인의 명복을빕니다.,0,0,0,0,0,0,0,1,0,0
가장 원시적인 폭력이 답임,0,0,0,0,0,0,1,0,0,0
김진 깜놀 ㅎㄷㄷ촬영후스트레스증후군,0,0,0,0,0,0,0,1,0,0
다이쥬 센세니뮤,0,0,0,0,0,0,0,1,0,0
지금생각해보면 나름 재미있었음 ㅋㅋㅋ,0,0,0,0,0,0,0,1,0,0
"부산도 대깨문들이 많기는 한데 경남,울산 민노총 좌빨들이 많은것도 크다.",0,0,0,1,0,1,0,0,0,0
씨발 이딴게 재밌냐,0,0,0,0,0,0,1,0,0,0
돈을 가진자가 곧 명령권자지,0,0,0,0,0,0,0,1,0,0
대한민국 교회 목사들의 수준을 잘 보여주고 있는것같다.사기꾼들한테 사기 당하지 말자,0,0,0,0,1,0,0,0,0,0
안하고 싶어도 인터넷 하다보면 한 시간내로 여혐 보고 열뻗쳐서 들어오게 되노. 실잦번탈놈들 모든걸 여혐으로 귀결지어서 워마드가 굴러간다 이기,0,0,0,0,0,0,0,0,0,1
시벌 사람 죽여놓고 미안하다면 다냐??? 책임을 져야지 이새끼들은 그냥 미안하다고 하면 다 용서되는줄 아네 ㅉㅉㅉ,0,0,0,0,0,0,1,0,0,0
자동차 판금 자격증딸때 용접 햇는데 와 ㅈㄴ 힘듬 재능이 한몫하는듯,0,0,0,0,0,0,0,1,0,0
불매운동잼 ㅋㅋㅋㅋ,0,0,0,0,0,0,0,1,0,0
한국인이 미국법으로 소송을 걸 수도 있나요? 잘 몰라서..,0,0,0,0,0,0,0,1,0,0
그 1900만명에 초딩도 들어가있는거임??,0,0,0,0,0,0,0,1,0,0
"성경에 버젓이 동성애는 옳지 않다고 써있는데, 목사가 당연히 성경 기준으로 가야되는거 아니냐? 무슨 소수자 인권이니 성 정체성이니 풀뜯어먹는 소리하지 말고 목사면 성경 기준대로 해라.",1,0,0,0,0,0,0,0,0,0
왜 우리 피같은 세금으로 암살 실패한 병신 빨갱이 새끼 밥이랑 잠을 몇년이나 해결해줘야하냐??,0,0,0,0,0,0,1,0,0,0
이자스민따위가 서울대 법대 강용석을....?,0,1,0,0,0,0,0,0,1,0
개만도못한 전라도 시바,0,0,0,1,0,0,0,0,0,0
아랍새끼들은 다죽여야해짱깨와 아랍새끼들은 다죽여야지,0,1,0,0,0,0,0,0,0,0
거짓말을 밥먹듯이 하는 이런 사람들이 목사라니..!!,0,0,0,0,1,0,0,0,0,0
그린벨트 ㅆㅅㅌㅊ,0,0,0,0,0,0,0,1,0,0
걍 정신병자네,0,0,0,0,0,1,0,0,0,0
"음모론이라고 생각하는게 이게 만약 진짜라면 오히려 더 이스라엘에 테러를 하지 않았을까? 의심사지 않기 위해서 사상자는 발생하지 않더라도, 주요기반시설 같은건 눈가리기로 테러라도 했을텐데",0,0,0,0,0,0,0,1,0,0
얼굴 ㅈㅅㅌㅊ 키 175 어깨 ㅍㅌㅊ,0,0,0,0,0,0,0,1,0,0
2배 간만에 준다. 국회로가라 게이야,0,0,0,0,0,0,0,1,0,0
남혐을 해도 미러링이 되고 농담을 해도 사실이 되는 마법! 진짜 한남은 얼마나 열등한 존재노 ㅋㅋㅋ 맨날 발기한놈만 봐서 10센치는 되는 줄 알았는 데 사실 노발기6.9도 안되노 진심 웃겼다 ㅋㅋㅋ,0,0,0,0,0,0,0,0,0,1
제발 방구석 일베에서만 지랄하지말고 나가서 기름이라도 몸에 부어 바꾸고 싶으면 !!!!!!,0,0,0,0,0,0,1,0,0,0
대구 중구 공평로사노 이기야,0,0,0,0,0,0,0,1,0,0
한남충 종특 = 죄의식X,0,0,0,0,0,0,0,0,0,1
개도 처음부터 잘 맞나보네 ㅋㅋㅋ 그냥 편하게 살지 ㅋㅋ근데 집으로 돌아가면 돈까스 탕수육 제육 생각나서 어쩌냐,0,0,0,0,0,0,0,1,0,0
노무현 사진 보여줬는데 웃으면 일게이지,0,0,0,0,0,0,0,1,0,0
컴퓨터에서 발견된 원본 사진,0,0,0,0,0,0,0,1,0,0
안타깝당. 고치려면 목숨 걸어야 겠다. 지성과 담력으로 세상과 승부ㅏ하자,0,0,0,0,0,0,0,1,0,0
자라는 청소년을 위해 많이 양산될듯,0,0,0,0,0,0,0,1,0,0
똥누고 바로 비데하더라도 휴지로 닦으면 여전히 똥 묻어 나오던데...존나 드릅네 씨발새끼들,0,0,0,0,0,0,1,0,0,0
대구경북 봉쇄하자 그냥봉쇄 반대하는건 존나 비양심적 아니냐?같이 뒤지자 이런건가.. 짱깨새끼들도 아니고,0,1,0,1,0,0,0,0,0,0
똥꼬충 허벌후장에 봉고데기 40mm 쳐넣고 온도 200도로 올려서 후장구이해서 종로에 전시해놔야함,1,0,0,0,0,0,0,0,0,0
"느그 나라도 백신 맞으면 추첨해서 로또 주고그러냐? 북미에서 화이자,모더나 남아도는데접종율이 생각보다 저조해서 백신 맞으면접종자 중에서 1백만 달러 몇 명 추첨해서 준다",0,0,0,0,0,0,0,1,0,0
레즈비언이 여자가 여자를 좋아하는 거잖아 저 트젠년은 지가 여자라 생각하는거지,1,0,0,0,0,0,0,0,0,0
굴은 원래 더러운거 먹으면서 자라는 생명체임...안먹는게 답임,0,0,0,0,0,0,0,1,0,0
저런게 홍어마인드다. 당장 눈앞의 이익만 쫓으면서 사는 좆버러지인생들,0,0,0,1,0,0,0,0,0,0
저 센터 민간단체다?ㅋㅋㅋㅋㅋ 난 무슨 국방부 산하기괸인줄 알았음,0,0,0,0,0,0,1,0,0,0
한국교회가 하나되길 간절히 소망합니다,0,0,0,0,0,0,0,1,0,0
돈 많노 ㅇ ㅂ,0,0,0,0,0,0,0,1,0,0
모를수가 있다는게 신기한거아니냐,0,0,0,0,0,0,0,1,0,0
애초에 한국여자란 몸섞는거자체가 위험하다이년들은 수틀리면 강간당했다함,0,0,0,0,0,0,0,0,0,1
와젼된거아니죠 큰일이네..,0,0,0,0,0,0,0,1,0,0
걱정도 팔자다. 여아가 필요했나보지. 남자애들 여장시키는거 흔한 일이다. 창작의 자유가 있다. 이래라 저래라 하지마라.,0,0,0,0,0,0,0,1,0,0
김어준 뉴스공장보기가 없네,0,0,0,0,0,0,0,1,0,0
늑대 사냥을 위해서는사나운 사냥개를 이용해야한다물론 늑대 사냥이 끝나면사냥개는 죽여버리지,0,0,0,0,0,0,0,1,0,0
"도태남들과 장애인, 미혼, 이혼남들을 위해 섹스서비스는 합법화되야 한다. 매매라는 부정적 어감도 바뀌어야됨. 창녀는 엄연히 4차산업인 서비스업 종사자다",0,0,0,0,0,0,0,0,0,1
공짜는 없는법이야 싼값에 골뱅이만들어서 게이들이 지 후장딸라는줄 모르고 좋아하고 있노,1,0,0,0,0,0,0,0,0,0
이거 왠지 예전에 오대양 사건이랑 비슷한듯. 정치하시는분들 이런일 또다시 일어나지않게  법적으로라도 방어해주세요,0,0,0,0,0,0,0,1,0,0
워념글 읽어보고 메모장이라도 켜서 니 생각 쓰는습관들여라이기 그러다보면 이해안가고 막히는 부분생기노 그럼 그부분에대해 고민하고 더 공부하면서 니 의견 확립해가면 된다이기 그게 워마드랑 백프로 일치할 수도 있고 아닐 수도 있는거노,0,0,0,0,0,0,0,1,0,0
틀딱들 분열 존내 일으키네 어디 뭐 나경은이 당대표되면 자리하나 준다냐,0,0,1,0,0,0,0,0,0,0
인류의 퇴보야 이건,0,0,0,0,0,0,1,0,0,0
여기서 제일 중요한건 저 누드모델이 저날 일당을 못받았을거라는거죠. 현대에도 레이싱걸이 그랬습니다..,0,0,0,0,0,0,0,1,0,0
난 가끔 본의아니게 어깨빵을 하는데 MP3 곡 찾는거때문에 MP3 들여다보고 걸으면 어깨빵 몇번씩 한다.,0,0,0,0,0,0,0,1,0,0
이래서 부래질리언 왁스를 해야하노 털이 자주 안나게 사춘기때부터 해줘야하노. 종로에 보니 아빠+아들 부래질리언 50% 할인! 있더노 후기에 호식이도 있으니 믿을만하노 제발 털관리좀 해라이기,0,0,0,0,0,0,0,1,0,0
씹선비 나라에선 꿈도못꿀일.. 뒤로는 더러운짓 다하면서 말야,0,0,0,0,0,0,1,0,0,0
꼴에 목사한다 ㅉ,0,0,0,0,1,0,0,0,0,0
대단하다. 그냥 휘갈겨 쓴 댓글일뿐일껀데,0,0,0,0,0,0,0,1,0,0
1번 기억폭행 팩트폭력 후팔 전영진 후장찢고 부랄터져 뒤져,0,0,0,0,0,0,0,0,1,1
내가 볼땐 틀무새나 좆족무새 똑같음 서로 허공만 때리면서 내가 더 타격감 좋았네 니가 쳐발렸네 거리고 있음 ㅋㅋㅋㅋ병신새끼들,0,1,1,0,0,0,0,0,0,0
선거는국회의원이하나 당신들이아무리날뛰어도  국민이투표로 심판한다 국민이 바보로이나 홍콩보았을것이다  보이나 봤나 국민을 우롱하면 그만큼의죄을받는다  두고보시라 지금이야 권력잡고있으니 마음대로하겠지만 국민이 바보가아니다,0,0,0,0,0,0,1,0,0,0
발렛이노?,0,0,0,0,0,0,0,1,0,0
다 받노 ㅋㅋ 어렸을 때 부터 지밖에 모르는 년 싸가지 없는 년 지 봊대로 하는 년 가스라이팅은 다 받고 자랐다 이기야 근데 보지답게 제일 잘나서 이젠 못 건드리노 ㅋㅋ,0,0,0,0,0,0,1,0,0,0
나도 훈련병떼 내꼬추 빨아준애 있엇음 .. 그뗀 자위안한지 3주넘어서 나도 미찻는지그냥빨렷다.. 정액도 존나만이싸고 ㅋ,0,0,0,0,0,0,1,0,0,0
그건 다문화가 아니라 식민지 아니냐?,0,0,0,0,0,0,0,1,0,0
이런거 볼때마다 집단광기 사이비신흥종교 같지않냐 ?아니 어떻게 정상인이 봐도 혐오스러운짓을 하면서혐오를 멈추어주세요 라고하는게 말이나 되는소리냐 ?,0,0,0,0,1,0,0,0,0,0
다문화인 차별하면 안되지. 이 십새끼들아. 진짜 웃기네. 그럼 쟤네들은 한국인 아니냐? 한민족이 아니라는 이유로?,0,0,0,0,0,0,1,0,0,0
음? 왜 차들이 서로 역주행하고 자빠졌노..,0,0,0,0,0,0,0,1,0,0
전라도에 대중목욕탕 졸라많다,0,0,0,1,0,0,0,0,0,0
다들 그렇게 싼다,0,0,0,0,0,0,0,1,0,0
여자들한텐 감성자극하고 정우성같은 미남배우 밀어서 세뇌시키고 남자들한텐 여자들 한번 당해봐야한단식으로 여론몰이해서 난민 받아들이자는 표수 늘리네,0,1,0,0,0,0,0,0,1,0
성소수자라 불리는 사람들을 비난하고 싶지 않다. 또한 보고 싶지도 않다. 보고 싶지 않은것 또한 내 권리 아닌가. 제발 나대지 말길,1,0,0,0,0,0,0,0,0,0
붓다 베이비,0,0,0,0,0,0,0,1,0,0
미국 소고기 파는 아줌마 따님도 부탁한다.,0,0,0,0,0,0,0,1,0,0
서초동200백만 조국사수 검찰개혁 그러는 니넨 1천명 어따. 대구. 에서. 뭐해~,0,0,0,1,0,0,0,0,1,0
이거 ㄹㅇ이다ㅋㅋ 정확히 바로 그거맞음ㅋㅋ,0,0,0,0,0,0,0,1,0,0
동감 상식적으로 납득안되는 처사지,0,0,0,0,0,0,0,1,0,0
이야 하나하나 글 다 읽어보고 있었노 ㅋ,0,0,0,0,0,0,0,1,0,0
ㄷㄷㄷㄷㄷㄷㄷㄷㄷ,0,0,0,0,0,0,0,1,0,0
이젠 대깨문이 아니라 폐깨문이다 ㅋㅋ 우한 폐렴 걸려서 뒤져도 자한당 일본 탓할 새끼들임 ㅋ,0,1,0,0,0,0,0,0,0,0
한번도 안감ㅋㅋㅋ 왜가냐? 씨발 남이 쑤신거에 박고싶나? 잡식성들이네. 비위존나좋네.그돈으로 국밥을 사먹겠다. 국밥이 몇그릇이고.,0,0,0,0,0,0,1,0,0,0
조상이 노비 출신임 물려줄 선산도 없으면서 근본없는 제사만 앵나 많음,0,0,0,0,0,0,1,0,0,0
"전라도 손님 모두가 개진상 손님이 아니지만개진장 손님 대부분은 라도 사투리 씀간혹 다른지역 말투쓰다가 진상이 안먹히면 흥분해서시방,~나가~,당께라는 말투 튀어나옴",0,0,0,1,0,0,0,0,0,0
"한국은 왜케 사기꾼 목사가 많은거냐:? 에휴..치안만 좋을뿐이지, 사기는 세계 1위",0,0,0,0,1,0,0,0,0,0
옛날부터 그랬고 지금도 그러는구나...뭐 초등학교 급식 나눠주는곳에 아줌마들도 그러더라 여자아이들 남자아이보다 적게준다고 ...불만있다고 여자아이가 그러더라,0,0,0,0,0,0,0,1,0,0
이건 무조건 여자 말만 믿고 일방적으로 생각하기는 조심스럽다.,0,0,0,0,0,0,0,1,0,0
꼴페미들을 상종 못하는이유=정신병,0,0,0,0,0,1,0,0,0,1
참고로 쿼터 600그램이 정량이다 43그램을 더 줬는데 그게 불만이라 저렇게 리뷰를 남김... 어메이징하다,0,0,0,0,0,0,0,1,0,0
어려운 시기에 총회장이라는 큰 직분을 맡으신 목사님.주님이 기뻐하시는 총회로 이끌어 가시길 기도하겠습니다,0,0,0,0,0,0,0,1,0,0
서울지검판사 ㅋㅋㅋㅋ우리 매형은 서울법원검사임 ㅋㅋㅋㅋㅋㅋㅋ,0,0,0,0,0,0,0,1,0,0
ㅇㄱㄹㅇㅋㅋㅋ 항문성교는 게이만 하는게아니야 레즈들도 좋아해 소수자혐이다 빼애액 이지랄하는 글많았었는데 지금생각해보면 똥꼬충들이 부랄떨면서 어떻게든 똥꼬충워딩못쓰게막으려고올린글이었는듯ㅋㅋㅋ,1,0,0,0,0,0,0,0,0,0
시발 ㅋㅋㅋㅋ 또라이새끼 ㅋㅋ 반대에다 스티커 붙힌줄 알았는데걍 찢었노 ㅋㅋ,0,0,0,0,0,0,1,0,0,0
"차별에 맞서?? 지라ㄹ 한다.. 나가서 정식 여군 지원하라고 이 비겁한 x아. 치사하게 언론 뒤에서 감성팔이, 핫이슈 건드려 생쑈하지 말고!",0,0,0,0,0,0,0,0,0,1
솔직히 남들의 시선이런것도 있겠지결혼할때 생각해봐라 상견례에서 남남이 손잡고 나오면 기가막힐듯사랑과 존중의 문제가 아니라 이건 질병이야. 매가 약이라는 뜻이지종족보존 본능을 위반하는거야,1,0,0,0,0,0,0,0,0,0
"돈주고 씹질한게 뭔잘못이냐 ㅇㅈㄹ하네ㅋㅋㅋ 불법이면 잘못이지 등신아ㅋㅋㅋㅋㅋㅋ 사람 죽여놓고 ""사람좀 죽일수도있지 뭔잘못?"" 이럴새끼네 이거",0,0,0,0,0,0,1,0,0,0
서양냄져는 여자를 강아지 취급하고 한국냄져는 여자를 가축취급함.,0,1,0,0,0,0,0,0,0,1
ㄹㅇ 아가씨에서 흑좃나 당연하게 연출한걸 가지고 페미라고 웅앵웅 주인공들이 남자조연들 다 죽이고 해피엔딩이면 페미 ㅇㅈ한다 이기,0,0,0,0,0,0,0,0,0,1
"도로에 트럭 세워놓으면 순간 한눈 팔면 박는거다 ,,",0,0,0,0,0,0,0,1,0,0
난민으로 들어가면 됨 문제 없음,0,0,0,0,0,0,0,1,0,0
결국 세금타령이네 ㅋㅋㅋㅋ 정치참여 안 해도 세금부과하면 클린한 거 아니냐 지지는 못받겠지,0,0,0,0,0,0,0,1,0,0
김치녀들에게 가장 알맞는건 갓슬람밖에없음 일도 하기싫고 힘든거 하기싫으면 갓슬람믿어야제,0,0,0,0,0,0,0,0,0,1
쌍도 연쇄살남 기머하노 이기,0,0,0,1,0,0,0,0,0,0
라도홍어란 이러하다사람색히가 아니제???,0,0,0,1,0,0,0,0,0,0
강도...,0,0,0,0,0,0,0,1,0,0
갓카 흑역사 ㅋㅋㅋㅋㅋㅋㅋㅋㅋㅋㅋㅋㅋㅋㅋㅋㅋㅋ,0,0,0,0,0,0,0,1,0,0
돈 있으면 다른나라로 탈조선하고 돈 없으면 하늘나라로 탈조선이네 ㅋㅋㅋㅋㅋ,0,0,0,0,0,0,1,0,0,0
모든거다 해줬는데 이정도면 니가 당했다는 망상아니노?,0,0,0,0,0,0,1,0,0,0
이게 왜 차금법이랑 연결이 되는지 이해안되는건 저뿐인가요???,0,0,0,0,0,0,0,1,0,0
그만좀 나온나,0,0,0,0,0,0,0,1,0,0
구라안까고 15년전에 봣다,0,0,0,0,0,0,0,1,0,0
솔직히 이렇게 광범위하게 분포되어있고 정이많은 지역인은 전라도 밖에없음다들 멀리 떨어져 있어도 매년 이렇게 향우회여는거보면 니네도 솔직히 부럽지?괜히 열등감가지지말고 부러우면 부럽다고 그냥 말하면되는거임,0,0,0,0,0,0,0,1,0,0
먹사새끼 중간다리간수잘해 소리소문 없이 하나님 영접할수있어.,0,0,0,0,1,0,0,0,0,0
와 폴아웃 구울보소 ㄷㄷ,0,0,0,0,0,0,0,1,0,0
가도 할일이 없어 가지마라 그래도 조선반도가 살만한거임,0,0,0,0,0,0,0,1,0,0
그저께는 진화론이 공산주의 사상이라고 지랄하는 병신 개독새끼도 있더만,0,0,0,0,1,0,0,0,0,0
나도 한인사회에 하나두아는사람이 없다 근데 뭐 별로외롭지도않고,0,0,0,0,0,0,0,1,0,0
쌍화탕 비니루에 담아서 줘라,0,0,0,0,0,0,0,1,0,0
아 이거 어떡해야되노 어떻게 끌올하지 이기야노,0,0,0,0,0,0,0,1,0,0
브금좀 넣지그랬냐놈놈놈 ost가 딱일듯,0,0,0,0,0,0,0,1,0,0
노오력해서 길고 얇게 반죽했노 ㅋㅋㅋ,0,0,0,0,0,0,0,1,0,0
여기 해피하우스아니냐,0,0,0,0,0,0,0,1,0,0
이휘재는 몰래몰래 공부했구나,0,0,0,0,0,0,0,1,0,0
쿵쾅이들좀 어떻게 해봐라 집에서 족발 3마리 쳐먹을시간에 운동좀 해라 제발,0,0,0,0,0,0,0,0,0,1
일게이들아 탈코르셋 운동 지지해라 여자의 탈코운동은 자살행위나 마찬가지다,0,0,0,0,0,0,0,0,0,1
이번엔 교장새끼 패라맞아 봐야 정신챙기지,0,0,0,0,0,0,1,0,0,0
지금 저지랄 했으면 영웅됐음,0,0,0,0,0,0,0,1,0,0
쓰까들한테 페미니즘이라는 이름을 내줄수없다 내가 페미다 쓰까는 똥물이다,0,0,0,0,0,0,0,0,0,1
난 그룹이오,0,0,0,0,0,0,0,1,0,0
근데 쌍도애들 인터넷에선 표준어 코스프레 존나 열심히 하잖아 ㅋㅋㅋㅋㅋ,0,0,0,1,0,0,0,0,0,0
두번째는 펨섭이라그래,0,0,0,0,0,0,0,1,0,0
수많은 식민지룰 호령 하던 영국이 지금 와서 저주를 받는건가 ㅋㅋ,0,0,0,0,0,0,0,1,0,0
저 좆놈 분명 성자한테서 3초찍으로 아다뗐다에 봊털 세 가닥 건다,0,0,0,0,0,0,0,0,0,1
"귀여운여자좋아해봤자노 숏컷보지들은 김치좆들한테관심 좆도없는데 우짜노~,",0,0,0,0,0,0,0,0,0,1
안밝혀진다에걸엇노 내말이 맞지않노 좆놈들은 진화되다말앗는 장애노 못풀거노 ㅋㅋㅋ 삽질만 하는게 한남종특아니노,0,0,0,0,0,0,0,0,0,1
짤에서 내림,0,0,0,0,0,0,0,1,0,0
어...욱일기닷,0,0,0,0,0,0,0,1,0,0
세월에 장사이ㅛ나 페미도 좌파도 틀딱사상 편입된 게지 . 것두 재미도 없고 내용도 밥 먹고살자는 생계형 페미 좌파라 더럽고,0,0,1,0,0,0,0,0,0,1
작가라서 소설쓰나보네,0,0,0,0,0,0,1,0,0,0
항문성교❤,1,0,0,0,0,0,0,0,0,0
살판 났구나,0,0,0,0,0,0,0,1,0,0
본인이쓴게맞나??,0,0,0,0,0,0,0,1,0,0
근데 애들이 백마의 피보다 똥양인의 피를 더 이어받은것같은..,0,1,0,0,0,0,0,0,0,0
미국의 병폐 또 등장.,0,0,0,0,0,0,0,1,0,0
퇴지금 줘야지끽동인가?옐로우?,0,0,0,0,0,0,0,1,0,0
ㅋㅋㅋㅋㅋㅋㅋ그렇게 좋아하는 북한가서 동성애하라 그래라,1,0,0,0,0,0,0,0,0,0
축구니깐 웃으면서 이야기하지. 저 새끼들 전쟁나도 중국편이야 ㅋ,0,1,0,0,0,0,0,0,0,0
근데 처음엔 왜 전원구조라고 개소리 한거냐,0,0,0,0,0,0,1,0,0,0
미.. 이런거 많이들어가는 것도 앵나 여혐. 권력을 쥐어라,0,0,0,0,0,0,0,1,0,0
개독이나 똥꼬나 그냥 똥퍼만 안하면됨.,1,0,0,0,1,0,0,0,0,0
6번문제광화문치킨,0,0,0,0,0,0,1,0,0,0
사우디 여자 너무 이쁘다. 히잡씌울수밖에 없다,0,1,0,0,0,0,0,0,0,1
기숙사생 야비군 왔어?,0,0,0,0,0,0,0,1,0,0
형님 안녕하세요 정말로 형님의 여동생분과 교제를 하고 싶습니다 꼭 연락주세요,0,0,0,0,0,0,0,1,0,0
만덕산 토굴가서 잠이나 자세요,0,0,0,0,0,0,0,1,0,0
한국당 잘하고 있습니다! 좌파들 난리쳐도 어용언론이 제대로 보도도 하지 않고 있어도..우파는 한국당 믿고 지지합니다! 힘내세요!,0,0,0,0,0,0,0,1,0,0
거식증때문에 168cm 49kg된적있노 학식련인데 언덕위에 있는 도서관만 가도 헉헉대고 눈앞이까매지고 세미시체였다이기.. 이제 다시 쪘더니 낮잠도 별로 필요없고 체력이 늘어난기분이노,0,0,0,0,0,0,0,1,0,0
그럼 신천지는 왜 아우팅했는데요? 성소수자들 차별이 아니라 특혜인데?,1,0,0,0,0,0,0,0,0,0
소설 읽고 인생거는 못배운 개 븅신새끼들ㅋㅋㅋㅋㅋㅋ탈좌파도 지능순이듯 탈개독도 지능순이다,0,0,0,0,1,0,0,0,0,0
캬 부산으로 가버렷,0,0,0,0,0,0,0,1,0,0
조선족과 중국인들 일부가..댓글 조작이라..ㅠㅠ,0,1,0,0,0,0,0,0,0,0
해당작업 반복,0,0,0,0,0,0,0,1,0,0
근데 법이 강화되야 나같은 진따들이 혜택받음.,0,0,0,0,0,0,0,1,0,0
ㅈㅈㅈㅈㅈㅈㅈㅈㅈ,0,0,0,0,0,0,0,1,0,0
암베르크 보고 반가움이 들면 진성일게이 ㅇㅈ?,0,0,0,0,0,0,0,1,0,0
생리? 지랄하고 짜바졌노 생리가 뭐 그리 대단하다고 시발김치년들 빼애애앳 버리노,0,0,0,0,0,0,0,0,0,1
이 정도면 군면제 해줘라~~~ 국위선양,0,0,0,0,0,0,0,1,0,0
우리에겐 진정한 인종차별주의자가 없다,0,1,0,0,0,0,0,0,0,0
알수없는 우울감 적절하노ㅋㄱㅋㅋ,0,0,0,0,0,0,0,1,0,0
개슬람=전라도 반박시 홍어인정,0,0,0,1,1,0,0,0,0,0
개독 vs 홍어 vs 개슬람종족 밸런스 쩌네,0,0,0,1,1,0,0,0,0,0
참 아이러니하다,0,0,0,0,0,0,0,1,0,0
근데 쫌 안된게 매매혼하는 사람들 대부분이 사는게 넉넉치않을텐데 얘네들 데리고 살면 매달 돈보내고 아니면 지마누라가 번돈 다 보낼텐데 쫌 안타깝더라,0,0,0,0,0,0,0,1,0,0
대화 내용 뭐냐? 영어를 몰라서.,0,0,0,0,0,0,0,1,0,0
엑스트라 귀환 커밍순,0,0,0,0,0,0,0,1,0,0
베이컨이구만,0,0,0,0,0,0,0,1,0,0
머구토박이인데 머구련중에 저렇게 길가는데 살면서 안당해본련없을거다 심지어 급식일때도,0,0,0,1,0,0,0,0,0,0
