문장,성소수자,인종국적,연령,지역,종교,기타혐오,악플욕설,clean,개인지칭,성별
"그렇게 좋으면 따라가야제,,,^^",0,0,0,0,0,0,0,1,0,0
대체 뭔 논리회로길래 미국 두둔했더니 친일논리가 나오는지ㅋㅋㅋㅋㅋㅋㅋㅋㅋㅋ,0,0,0,0,0,0,0,1,0,0
난 젠더 논란 이라해서 저냥반이 트렌스젠더인줄,1,0,0,0,0,0,0,0,0,0
영원한 적은 없고 영원한 친구 또한 없다,0,0,0,0,0,0,0,1,0,0
"비아냥 거리지는 맙시다. 이번에 민주당 절대 폭력 안쓴거 진짜 잘했어요. When they go low, we go high",0,0,0,0,0,0,0,1,0,0
재밌겠노 마ㅋㅋㅋㅋ손아람 그새끼부터 패자,0,0,0,0,0,0,1,0,0,0
치와와같이 생긴 중국통역사랑 스캔들이 사실인가??,0,0,0,0,0,0,0,1,0,0
봊나 대가리에 뭐가 들은건지 이해가 안되노 한남충들 다 재기가 답이다 이기,0,0,0,0,0,0,0,0,0,1
ㅉㅉ 왜 광화문가서 돈 수거하지?,0,0,0,0,0,0,0,1,0,0
ㅂㅂㅂㄱ2ㅂ,0,0,0,0,0,0,0,1,0,0
여군들이 같이 복무 하기 싫다고 반대하지 않았었나?,0,0,0,0,0,0,0,1,0,0
신사동호랭이 음악 다신못하게 프젝 ㄱ ㄱ,0,0,0,0,0,0,1,0,1,0
한그릇하고싶다,0,0,0,0,0,0,0,1,0,0
개독 이 씨발년들은 지가 잘못해놓고 엄한데 가서 용서 구하고 있음 ㅋㅋ,0,0,0,0,1,0,0,0,0,0
이건 민주화유공자로 특별사면시키야된다,0,0,0,0,0,0,0,1,0,0
3번 테러용의자 저새낀 뭔데 폭탄만들라고 고대 설대 대학원 다녔냐,0,0,0,0,0,0,1,0,0,0
뒤에 붙여진거 보니까 고등학교같은데 저런건 누가 붙여서 만드는거임,0,0,0,0,0,0,0,1,0,0
"퇴직금 받고, 세금 내고 하면 되잖아. 얼마를 받던지 세금 안 내니까 공평치 않지!",0,0,0,0,0,0,0,1,0,0
이목구비 진한 게 왜 인기 없는지아냐?김치년들 지들이 모두 무쌍꺼풀인데 쌍수해서 나중에 애낳으면무쌍꺼풀 실눈을 남편탓하기 좋아서 그래 ㅋㅋㅋㅋㅋㅋㅋ순진하네 한남들ㅋㅋㅋㅋ,0,0,0,0,0,0,0,0,0,1
병신들이 확실해!!,0,0,0,0,0,0,1,0,0,0
저거 글 쓴놈이나 필터링 안하고 올려준놈이나 수준보소ㅋㅋㅋ이래서 지잡지잡 하는거지,0,0,0,0,0,1,0,0,0,0
솔직히 이건 부정못함ㅋㅋㅋㅋ,0,0,0,0,0,0,0,1,0,0
문벌레충들아 잘한거 1이라도 말해봐 코리아가 아니고 코리안이 잘한거지 문폐렴은 세계 정서에 반하는 동북공정에 앞장서 신남방정책이라 부르며 짱개몽에 혼밥처먹고 짱개에 충성하는 동남아 총아를 이루며 자국민을 짱개 예속국민으로 만들 뿐이다 더러운사상을 가진 정신병자다,0,1,0,0,0,1,0,0,0,0
코로나는 하나님이 회개하라고 주어진 시간이라고 생각합니다. 비록 모임금지와 예배를 드리지 못하는 박해의 시기를 견디고 있지만 초대교회의 사도들과 성도들의 신앙을 본받아 견디고 승리하면 반드시 좋은 날이 올거라고 생각합니다.,0,0,0,0,0,0,0,1,0,0
노벨상 유력후보에 올라야한다노!!!,0,0,0,0,0,0,0,1,0,0
햄버거 시켯는데 시발...,0,0,0,0,0,0,1,0,0,0
뭔 개소린지 모르겠네 90아재다,0,0,0,0,0,0,1,0,0,0
울면서 전화씹는거보니 팩트네 ㅋㅋㅋㅋㅋㅋㅋㅋㅋㅋㅋㅋㅋㅋㅋㅋㅋㅋㅋ,0,0,0,0,0,0,1,0,0,0
어디갓니???????????????????????????????? 자칭중립 자칭합리적보수 버러지들 어디갓니?,0,0,0,0,0,0,1,0,0,0
야 아이들 학대하지말라니까? 어?,0,0,0,0,0,0,0,1,0,0
아직도 처 놀러가는거 보면 속에 천불이난다,0,0,0,0,0,0,0,1,0,0
22 다들 튈 준비하는건 아닌가싶다,0,0,0,0,0,0,0,1,0,0
머리채잡는 물귀신들 필요없다 이기야,0,0,0,0,0,0,1,0,0,0
아따 선택적으로 분노 한다는 그 학교 학생들이구만,0,0,0,0,0,0,1,0,0,0
선행은 나누어야 밝아 집니다. 분노장에의 나라에서는,0,0,0,0,0,0,0,1,0,0
붕신 나 롯머리아 4일하고 때려쳣다 ㅅㅌㅊ?,0,0,0,0,0,0,1,0,0,0
어떤 웜련은 나년으로 수정하라하더노 어느 장단에 맞추라는 쀼젤ㅋ,0,0,0,0,0,0,1,0,0,0
이준석 할말했네 남녀평등 장학금도 성적도 평등해야지 녀자들도 존심 안 상할려면,0,0,0,0,0,0,0,0,1,1
봤는데 여자 흑발 존나 예쁨,0,0,0,0,0,0,0,1,0,0
항상 통진당이랑 행동을 같이하면서 빨갱이라고 부르지말래 민통당섹기들,0,0,0,0,0,1,0,0,0,0
재기는 재기의 신이다. 재기영역의 재기라서 아무도 재기는못따라가노,0,0,0,0,0,0,0,0,0,1
"아그들아, 홍천엔 왜 오냐고. 여긴 청정지역인데...!!!",0,0,0,0,0,0,1,0,0,0
이건 차별로 인한 불쾌감이 아니라 병신같은 정책에 대한 반감이다.,0,0,0,0,0,0,1,0,0,0
ㅋㅋㅋㅋㅋㅋㅋㅋㅋ시발 이제쫌끝낫네 제발좀 지역떡밥좀일으키지마라 짜증만나고 재미도없고 왜있는지모르겠다 그냥 올리는놈들한테는랩업용이겠지만,0,0,0,0,0,0,1,0,0,0
보력가라 후팔 몰카한남충 재기해,0,0,0,0,0,0,0,0,0,1
이거 개꿀팁인듯 잘 써먹을게,0,0,0,0,0,0,0,1,0,0
좆중에서도 ㅆㅎㅌㅊ좆들이노,0,0,0,0,0,0,0,0,0,1
한국교회 전체를 세우시는 세움총회 기대되고 기도합니다,0,0,0,0,0,0,0,1,0,0
난 삼국지 중에서 제일 좋아하는 캐릭터 = 유방,0,0,0,0,0,0,0,1,0,0
개쩌노시발.. 수영에 자신이있엇다라는건데 망설임없이 뛰어든거면,0,0,0,0,0,0,1,0,0,0
걸게 망하겠노,0,0,0,0,0,0,1,0,0,0
보고싶다이기야,0,0,0,0,0,0,0,1,0,0
자꾸 블라인드 되노,0,0,0,0,0,0,0,1,0,0
ㅋㅋㅋ '추'로 해놓고 선동 보소,0,0,0,0,0,0,0,1,0,0
김치좆놈들 ㅆㅎㅌㅊ 똥꼬충적 여혐하는게 노무딱 웃김 진짜 자지는 다 미개하고 열등하지만 국산남이 그중 열등하기는 제일이노 풉,1,0,0,0,0,0,0,0,0,1
구라 안까고 60대 초중반까지는 씹가능미시 하악하악,0,0,0,0,0,0,1,0,0,0
좀 꺼져라 개좆족 새끼들아ㅋㅋㅋㅋㅋ,0,1,0,0,0,0,0,0,0,0
자집애들 진지할 때가 제일 웃기노,0,0,0,0,0,0,0,0,0,1
다 생긴거 괜찮을듯한 남자들만 찍었네. 기럭지 짧고 옆으론 두껍고 남성형 유방과 골반 면상은 함몰에 뒤통수 눌린 조선보지들은 감히 비비지도 못할 레벨인데... 아무래도 은근 맘에들어서 클리 비빌때 쓰려고 찍은듯 하다.,0,0,0,0,0,0,0,0,0,1
뜬금없지만 최소 이정도는 사라 하는 헤드폰&오디오 인터페이스가 있을까요??? 아니면 좀 추천좀 해주실수 있나요? 글 읽어보니 상당히 수긍이가네요 허나 이쪽으로는 잘 몰라서 어떤걸 사야 하는지는 잘 모르겠습니다,0,0,0,0,0,0,0,1,0,0
스윗 오타인줄 알았는데 스윙 맞네,0,0,0,0,0,0,0,1,0,0
젠더를 찬성하면 열린의식이고 반대하면 닫힌의식인가? 당신의 그런 발언자체가 차별아닌가? 그럼 열린마음 여군소령A씨가 그 분과 같은방 쓰면 되겠네,1,0,0,0,0,0,0,0,0,0
세계적으로 에이즈 감염률이 낮아지는데 유독 대한 민국은 에이즈 감염률이 높아지고 있다 누가 그들의 미래를 보장해줄 것인가? 청소년들이 성중독에 빠지지 않게 보호하는것이 기성세대의 몫일텐데 요즘 너무나 많은 BL웝툰 만화가 판을친다 .,1,0,0,0,0,0,0,0,0,0
아니 이분 하루종일 드립 연구만 하시나 ;ㅁ;,0,0,0,0,0,0,0,1,0,0
남혐 아니라고 딸바보아빠들아 정신차려,0,0,0,0,0,0,0,1,0,0
왜 죄다 어디서 본 얼굴들이노 ㅋㅋㅋㅋㅋㅋ,0,0,0,0,0,0,1,0,0,0
sns에서 대놓고 명품이나 가구같은거 자랑질하는 년들은 실제로는 돈도 별로 없는 어중간한 계층임 진짜 부자들은 골프 치러 필드 나가거나 파티에 초대해서 자연스럽게 저런 말 주고받음,0,0,0,0,0,1,0,0,0,1
김해는 아무리 추워봤자 -1 ~ -2수고해라 서울 게이들 -15 엥? 거기 사람 사는 곳 맞냐?,0,0,0,1,0,0,0,0,0,0
아따 아줌씨 나으 부모님의 세금으로 만들어진 밥상이니께 쪼까 열심히 하쑈잉,0,0,0,0,0,0,0,1,0,0
리더십 좋아하시네.,0,0,0,0,0,0,1,0,0,0
뭐얌 아는 형아 죠기있넹 ㅋㄷㅋㄷ,0,0,0,0,0,0,0,1,0,0
깔깔 자들자들거리노,0,0,0,0,0,0,0,0,0,1
진실이 있는 곳에 백상현기자가 있다. 응원합니다.,0,0,0,0,0,0,0,1,0,0
청원 자체가 메갈들 매크로 돌린거,0,0,0,0,0,0,0,0,0,1
젠신병은 정신병이노.,1,0,0,0,0,0,0,0,0,0
똥꼬충이 고통받는단 착각 좀 똥빨러들이 멈추길 바라노. 레즈들은 비공개로 꽁꽁 숨어도 사이트 털고싶어 부랄발작이 모여들고,1,0,0,0,0,0,0,0,0,0
창조경제ㅋㅋㅋㅋㅋㅋㅋㅋㅋㅋㅋㅋ 급식충들 천원들고 경찰서행ㅋㅋㅋㅋㅋㅋㅋㅋㅋㅋㅋㅋㅋㅋㅋㅋㅋㅋㅋㅋㅋㅋㅋㅋㅋㅋㅋㅋㅋㅋ,0,0,1,0,0,0,0,0,0,0
혹한의 추위를 퍼스트펭권의 허들링으로 이겨낸 것처럼 얼어붙은 한국교회의 이미지회복과 부흥을 위해 찬란한 바보가 돼 낮아지고 섬기고 희생도 해야겠습니다,0,0,0,0,0,0,0,1,0,0
6햇님 지지안하는 웜퇘지9가 실제로 있노? 6남충있는 웜퇘지9 만큼이나 역설적으로 들리노.,0,0,0,0,0,0,0,0,0,1
진짜 경찰인줄 아는거냐 설마.. 시발;,0,0,0,0,0,0,1,0,0,0
태영호의 미성년자 강간 의혹에 대한 진상규명도 곧 이뤄지겠지.,0,0,0,0,0,0,0,1,0,0
뭘 잘했다고 불법 체류를 사면 해달라는거지? 씨발 짱깨새끼들이,0,1,0,0,0,0,0,0,0,0
크 ㅂㅂㅂㄱ ㅋㅋㅋ,0,0,0,0,0,0,0,1,0,0
존나 패버리고싶네,0,0,0,0,0,0,1,0,0,0
주작이네. 기사 검색이 안되잖아,0,0,0,0,0,0,0,1,0,0
가지가지한다 다문화새끼들,0,1,0,0,0,0,0,0,0,0
이거 짱깨 떼놈은 안되고 쪽바리 토착왜구는 쓸수 있다던데 사실인가요 ㅋ 중국 속국이 되려고 발악하네 아주 이번에 흑인 인종차별 반대 시위도 중국인들이 했다며??,0,1,0,0,0,0,0,0,0,0
Gs 잘알앗어~ 안산다,0,0,0,0,0,0,0,1,0,0
아니 근데 돈을 그렇게 퍼주긴 함??우리집은 한번도 안받아서 모르겟는데;;존나 진짜 딴세상인가,0,0,0,0,0,0,0,1,0,0
"우리나라에도 대통령이라는새퀴가 미개한중국몽을꿈꾸고있다,",0,1,0,0,0,0,0,0,0,0
틀니들이 돈걷어서 2030무임승차 해줘야함,0,0,1,0,0,0,0,0,0,0
남녀관계 폭행은 초범에 골절이나 영구 장애안생기는 범위안에는 훈방때려야 저년들이 한대씩 처맞어본 경험이 생겨 안깝치지남자한테..,0,0,0,0,0,0,0,0,0,1
이젠뭐 웃기지도 않다,0,0,0,0,0,0,1,0,0,0
그러게 누가 벤츠를몰래,0,0,0,0,0,0,0,1,0,0
야쿠르트 소매중개인,0,0,0,0,0,0,0,1,0,0
일단 한국인의 숫자 자체도 많고다른 아시아 국가에서 미국 갈 정도면 돈 많은 애들이 대부분이겟지,0,0,0,0,0,0,0,1,0,0
어떤 집단이든 잘못된 부류는 있다 근데 저건 테러리스트다,0,0,0,0,0,0,1,0,0,0
지역에서 기독교 믿는 유권자들에 널리 알려지면 영향이 있을수도 있겠네,0,0,0,0,0,0,0,1,0,0
미친다씨발ㅋㅋㅋㅋㅋㅋㅋㅋㅋㅋㅋㅋㅋㅋ,0,0,0,0,0,0,1,0,0,0
치욕을 받았노,0,0,0,0,0,0,0,1,0,0
ㅋㅋㅋ 중국년들이 일본어 쓰고 옷도 니뽄진같이 입고 한남들 꼬셧구먼 ㅋㅋㅋㅋ 하여간 일본어만 쓰고 치마만 입으면 사리분간 못하는 일뽕 꼬추새끼들 좀 안뒤지냐? 어휴 ㅉㅉ,0,1,0,0,0,0,0,0,0,1
여자들은 논리적사고가 안되는 생물임. 자기밖에 모름,0,0,0,0,0,0,0,0,0,1
아싸~~헬렐레야~~,0,0,0,0,0,0,0,1,0,0
돈주고 스섹하는게 왜 잘못됬냐 물어보면 답못함그냥 경찰들도 잡아놓고 사적인거 침해하면서 잘못했다고 몰아가고,0,0,0,0,0,0,0,1,0,0
선물은 딜도,0,0,0,0,0,0,0,1,0,0
전부다 그런건 아니다예전에 새터민 마지막으로 일반인 집에서 하루 자고 가는거 우리집에서 한번 했었는데 그때 북한 실상도 많이 듣고아직까지 연락하면서 지내는데 열심히 일하면서 한국에서 사는거 만족하더라,0,0,0,0,0,0,0,1,0,0
정말 이젠 저런 늙은 상폐년들 처량하고 애처롭다. ㅋㅋㅋㅋ,0,0,1,0,0,0,0,0,0,1
火기 찬 하루,0,0,0,0,0,0,0,1,0,0
싫어하는데 이유 없다. 싫어할 자유도 있는것이다,0,0,0,0,0,0,0,1,0,0
피해여자가 더 않생기게 법률보완하고 상담할수 있는곳이 많아 져야 됩니다 그런데 말입니다 남자가 다 그런것처럼 여론 몰이 하지 맙시다 그리고 와국여자 때문에 남자가 엄청 당하는 것도 취재 하세요,0,1,0,0,0,0,0,0,0,1
면제 시켜줘도 저 난리다.,0,0,0,0,0,0,0,1,0,0
"틀딱 까는글로 경험치 올려야하는데 정치글 안 보이니 저 지랄하는거지이제 또 노포 포경, 키 얼굴 떡밥 돌리겠지 좆병신 찐따새끼들",0,0,0,0,0,0,1,0,0,0
막짤 로동당,0,0,0,0,0,0,0,1,0,0
오토바이 몰고가는 급식 색히 한테는 물건과적 이라는 이라는 스킬이 부여됨 ㅋㅋㅋㅋㅋㅋㅋㅋㅋㅋ,0,0,1,0,0,0,0,0,0,0
설 연휴 쉬려고 총파업,0,0,0,0,0,0,0,1,0,0
여자는 개패듯이 패야한다고 했다99는건 파출소장이 했다는 말이고 66파출소장도 못하겠네,0,0,0,0,0,0,0,0,0,1
나이 40 처먹고 애니짤이나 달고 다니는 새끼들이 제정신이겟냐?싹 다 전라도로 모아서 처 죽여야 됨,0,0,1,1,0,0,0,0,0,0
근데 WHO가 코로나 확산방지에 어떤 도움을 줬는지 반문하고 싶다. 오히려 WHO로 인해 세계 각국이 심각성을 인식 못하고 소극적으로 대처한거 같은데...,0,0,0,0,0,0,0,1,0,0
친이슬람 유교개독 한걸레,0,0,0,0,1,1,0,0,0,0
한편인가?,0,0,0,0,0,0,0,1,0,0
동향동향 진짜 저쪽것들은 동향 좋아하네,0,0,0,0,0,0,1,0,0,0
창작련인데 양놈충이랑 한남충 둘이 자적자하는 내용 쓰고있노 ㅋㅋ 참고하겠다 ㅋㅋㅋ,0,0,0,0,0,0,0,0,0,1
자릉 자릉 자르르르르르르르르르르르릉,0,0,0,0,0,0,0,0,0,1
나도 비슷한상황잇엇는데 차 움직일때까지 크락션누르고 잇으면됌,0,0,0,0,0,0,0,1,0,0
멕시코 새끼들 일부러 미국좆돼라고 난민들 넘어가는거 방치하는것같다,0,1,0,0,0,0,0,0,0,0
일베에도 사자좀 풀어야함 틀딱새끼들,0,0,1,0,0,0,0,0,0,0
퍄퍄 시위자분들 유-쾌해보이고 노무딱 좋노 애애애앵나 부랄발광해서 바로 잡아야한다 이기야노,0,0,0,0,0,0,0,1,0,0
나도 중간에 혐애할뻔했는데 중급식때부터 웜 달리면서 모쏠인 쀼젤ㅋㅋㅋㅋ 앞으로도 모쏠일 계획이노,0,0,0,0,0,0,0,1,0,0
15년전일을왜지금..미묘하네요,0,0,0,0,0,0,0,1,0,0
어떤 간식을 쳐드시길라 600만원임,0,0,0,0,0,0,0,1,0,0
식당도 식당인데 데드풀 친구랑 보러갔는데 옆에서 뽀로로 틀어주던 옆자리 생각난다.....파스슷.....,0,0,0,0,0,0,0,1,0,0
21남? 18여? 끄덕끄덕,0,0,0,0,0,0,0,1,0,0
개독들도 미쳐있는 사람이 있는 반면 그냥 패션처럼 교회가는 사람있자너이슬람 애들이 돼지고기 없어서 못먹는거지주면 잘만 먹는다.,0,1,0,0,1,0,0,0,0,0
사람답게 살수 있게 해달라는 말은 맞지 않습니다. 군형법을 없애서 형을 안산다고 사람답게 사는것이아니라 동성애를 끊는것이 사람답게 사는것입니다.,1,0,0,0,0,0,0,0,0,0
"목사 일가의 끊임없는 성추문, 사기, 아동학대, 갑질 등 종교라는 미명 아래 인간 존엄을 무시한 범죄가 일어나고 있으니 기독교는 종교로서의 기치를 잃어버렸다.",0,0,0,0,1,0,0,0,0,0
10대 20대 여자들은 한국국적 남자 새끼 낳으면 영주권 주고 외노자 남자새끼들은 외노자 등록시켜서 세금 받고 안산에서 개노가다 시킨 담에 돈 해외송금 못하게 막자.,0,1,0,0,0,0,0,0,0,0
결혼하고 한국데려온 남자인데 개종필수라고하더라,0,0,0,0,0,0,0,1,0,0
그냥 기존의 장애인택시를 여성도 이용하게 하면 되자너 대수도 늘리고,0,0,0,0,0,0,0,1,0,0
전라도는 다 맛있제잉 ㅋㅋㅋㅋㅋㅋ,0,0,0,0,0,0,0,1,0,0
심지어 힐윈드라고 알고있던 난....,0,0,0,0,0,0,0,1,0,0
이제 남은것은 하늘에서 유황불 떨어지는것만 남았다.ㄷㄷㄷ,0,0,0,0,0,0,0,1,0,0
통구이들 특징 : 지들 까이는 떡밥이면 급하게 화제 전환 마 ! 이게 쌍도 남자 아이가,0,0,0,1,0,0,0,0,0,0
인류 발전을 위해 무슬림은 싹다 멸절시켜야함,0,0,0,0,1,0,0,0,0,0
돈도 못 버는 놈들이 더 유난질이더라 ㅋ 월 1000만원 이하인 농들은 여자가 니들한테 취집올까봐 불안해 하지마~ 맞벌이에 집반반 울부짖으면서 취집 걱정 꽃뱀 걱정ㅋㅋㅋㅋ,0,0,0,0,0,1,0,0,0,1
으 한국남자노,0,0,0,0,0,0,0,0,0,1
우리나라의 성인식의 현주소를 극명하게 나타내는 사건으로 기록될 것이다.,0,0,0,0,0,0,0,1,0,0
초중딩때는 남자가 이름순으로 앞번호했는데 고딩때는 뒷번호 함,0,0,0,0,0,0,0,1,0,0
동물 식물도 다 암수가 있고 그렇게 번식하는게 일반적인거입니다. 동성애는 성정체성의 부족입니다. 그건 치료를 받고 교육을 받아야하는거죠,1,0,0,0,0,0,0,0,0,0
트롯은 홍자 미만 잡,0,0,0,0,0,0,0,1,0,0
주말도아니고 평일이잖아 .상대적으로 노는년들이 남자보다 더 많으니 ㅇㅇ,0,0,0,0,0,0,0,0,0,1
이런 거 생각하는 사람 누군지... 틀딱 교무과 아재겠지,0,0,1,0,0,0,0,0,0,0
동성이든 이성이든 이 시국에 코로나 걸렸으면 동선공개 기본이죠.,0,0,0,0,0,0,0,1,0,0
흙수저고 뭐고 간에 가스렌지 좀 닦아라.,0,0,0,0,0,0,0,1,0,0
기안내나노 ㅋ,0,0,0,0,0,0,1,0,1,0
웅앵웅 자기소개,0,0,0,0,0,0,0,1,0,0
뭐래노 씹창년이개독교는 원래부터깟어이명박이 개독 쉴드췰때도 안깐줄암?니들이 믿고 하는짓이 그냥 한무당새끼나 다를게 없으니까는거지 별다른이유가있는게아님 ㅋㅋ,0,0,0,0,1,0,0,0,1,0
문재인이가 또....,0,0,0,0,0,0,1,0,1,0
여유롭게 자지빠는거보소 ㄷㄷ,0,0,0,0,0,0,1,0,0,0
역대급 띵문이노,0,0,0,0,0,0,0,1,0,0
건데 말이되냐 4년공공의대 대학원 과정으로 하고 10년간 강제복무 말이되는 소리를 해야지 앞뒤가 안맞쟎아 그리고 대학 원이면 남자면 대부분 대학졸업하고 군대 갔다와야 되는데 병역 애기는 왜나오나?,0,0,0,0,0,0,0,1,0,0
급식체 분탕으로 처리하고 벤하면 안되나,0,0,1,0,0,0,0,0,0,0
ㅓㅜㅇ 묵직,0,0,0,0,0,0,0,1,0,0
무슨 개나 소나 목사래!,0,0,0,0,1,0,0,0,0,0
외국 기독교인들한테는 어떤 반응이냐??,0,0,0,0,0,0,0,1,0,0
험난한 길 잘 가실수 있도록 기도하겠습니다. 하나님께서 기뻐하시는 일들을 잘 해내실수 있도록 간절히 기도하겠습니다.,0,0,0,0,0,0,0,1,0,0
남자보다 못하네ㅐ ㅋㅋㅋㅋㅋㅋ,0,0,0,0,0,0,0,1,0,0
냄저 죽이고싶을정도로 싫어하는 년들한테 욕이랍시고 한다는 소리가 냄저가 너를 안사랑해줄거야!!!!!!!!!!1111병신좆들,0,0,0,0,0,0,0,0,0,1
336 말처럼 CCTV 사각지대 도서관 발 찾아서 베스트셀러,0,0,0,0,0,0,0,1,0,0
속이 다 시원하네땡큐,0,0,0,0,0,0,0,1,0,0
여자가 저런 생각을 한다는건 사타구니를 검사 해봐야 한다,0,0,0,0,0,0,0,0,0,1
여성 범죄 피해자가 많으면 차별인건가..? 범죄자들아 남자여자 꼭 번갈아가며 비율맞춰 범죄해라! 라고 말해야 평등한 사회?ㅋㅋ 가사노동시간은 적고 임금노동시간은 안 적는 평등한 기사ㅋㅋㅋ,0,0,0,0,0,0,0,1,0,0
비친씨발ㅋㅋㅋㅋㅋㅋㅋ,0,0,0,0,0,0,1,0,0,0
태국에서 트젠이랑 한적있다.아니... 당했다.,1,0,0,0,0,0,0,0,0,0
별로안유명해도 돈 개많은가보네 ㄷㄷㄷㄷ,0,0,0,0,0,0,0,1,0,0
남과 여가 분명하게 서로 다른데 자꾸 남자와 여자는 똑같다.라는 말들을 한다. 어릴때부터 서로 다름을 가르처야하는데 그렇지 않으니까 커서도 진짜로 남자와 여자는 똑같은줄로알고 행동하다가 사고듣친다.,0,0,0,0,0,0,0,0,0,1
막내가 예뻣으면 이런일 없다예쁜 여자는 저런데 한눈팔릴 틈조차 없음,0,0,0,0,0,0,0,0,0,1
저게 왜 잘못된거?,0,0,0,0,0,0,0,1,0,0
여자들이 미개해서 그래..,0,0,0,0,0,0,0,0,0,1
씨팔 죽어라 좀 쓰레기새끼,0,0,0,0,0,0,1,0,0,0
게이에서 원래 트젠되는거다 그리고 잘생긴애들 많음,1,0,0,0,0,0,0,0,0,0
씨발 영감새끼야 틀니 발로밟아부셔버릴라 주작질하고있노,0,0,1,0,0,0,0,0,0,0
누구누구 사장님 일하러 안나왔냐고 물어보는거애서 씹소름,0,0,0,0,0,0,0,1,0,0
영화가 아니고 소개팅 여자인줄 알았나 보지,0,0,0,0,0,0,0,1,0,0
한국남자들 수준 처참하다ㅋㅋㅋ 역사상 가장 옹졸하고 찌질하게 기억될듯ㅋㅋㅋㅋㅋㅋㅋㅋㅋㅋㅋㅋㅋㅋㅋㅋㅋㅋㅋㅋㅋㅋㅋㅋㅋㅋㅋㅋㅋ 강간 몰카 살인하지 말랬더니 지들행동은 안고치고 저러고있네ㅋㅋㅋ🤏이게그렇게무섭냐,0,0,0,0,0,0,0,0,0,1
지랄이다 아시아 이민계에서 중국 일본 다음 이구먼,0,0,0,0,0,0,1,0,0,0
"정작 진짜 피해자인 아동에 대한 공감은 없고, 오로지 여자만 편들며, 사건 자체를 남성혐오의 도구로 써먹고 있는 베댓들 소름끼친다. 저게 여자들이 말하던 공감능력의 실체",0,0,0,0,0,0,0,0,0,1
이거 ㄹㅇ 이냐 ㄷ ㄷ,0,0,0,0,0,0,0,1,0,0
손팻말 그래 우리 같이 보다 그래 우리 끼리 좋을듯 그쪽은 그쪽 세상에서...별로 관심없어 한 말씀 남깁니다.,0,0,0,0,0,0,0,1,0,0
뒤진놈팬티사진없노?,0,0,0,0,0,0,1,0,0,0
"애초에 군 호봉제 자체가 무식한 성차별 행위임 군대랑 회사 월급이랑 아무 상관없는데, 성 차별하고싶은 기업이 군대를 교묘히 이용한 것임",0,0,0,0,0,0,0,1,0,0
ㅋㅋㅋ 대단하다 저런거보면,0,0,0,0,0,0,0,1,0,0
돈없네 ㅋㅋ,0,0,0,0,0,0,0,1,0,0
그거 일게이아니였노 엌 ㅋㅋㅋㅋㅋ,0,0,0,0,0,0,0,1,0,0
소통과 공감으로 한국교회가 하나되길 바라며  성탄절에는 교회가서 예배 드리길 기도합니다,0,0,0,0,0,0,0,1,0,0
교회가 방역을 철저히하여 한국교회가 세상가운데 희망이 되기를 바랍니다.,0,0,0,0,0,0,0,1,0,0
막노동을 해도 한국에살고말지 미쳤다고 남미를가냐?차라리 자살을하겠다.,0,1,0,0,0,0,0,0,0,0
누군지도 몰랐는데.. 참,0,0,0,0,0,0,0,1,0,0
시발 존나 지금 알았노 ㅋㅋㅋㅋ,0,0,0,0,0,0,1,0,0,0
좆족스럽게 생겼노 ~ 캬악 퉷 씨발 이성계,0,1,0,0,0,0,0,0,0,0
"좌표 찍고 행동하는 것은 남혐 성향의 커뮤니티 성향을 미러링한 것처럼 보이지만, 페미 혐오와는 완전히 다른 여혐성 발언 또한 삭제한다고 하였기에, 근본이 다르다. 역시 서울대다.",0,0,0,0,0,0,0,1,0,0
어디 최씹니꺼,0,0,0,0,0,0,0,1,0,0
강간해봤어요? 성범죄자에요? 성추행해봤어요?(택1) 해봤을거같은데?ㅋㅋ 그 뒤엔 유도리있게 어쩌고저쩌고,0,0,0,0,0,0,0,1,0,0
개소리 ㄴ ㄴ해 오바마 돼지고기 쳐먹음,0,0,0,0,0,0,1,0,0,0
나 에프인데 어느정도맞는듯,0,0,0,0,0,0,0,1,0,0
조금이라도 몸값 올리려고 발악하노 ㅉ 냄져새끼들 하나같이 다 여우다,0,0,0,0,0,0,0,0,0,1
알립니다. 이미 페미들에게 좌표가 찍힌 기사입니다.,0,0,0,0,0,0,0,0,0,1
별 쓸데없는 소리로 괴롭히는구나 일 좀 하게 냅둬라,0,0,0,0,0,0,1,0,0,0
대체 정신병자 이성애자 질충새끼들은 왜 허구헌날 성범죄 저지르는거냐?대가리속에 성범죄 저지를생각밖에 없는듯 ㄷㄷ 이래도 이성애가 정신병이 아니라고?이성애자 = 성범죄자,0,0,0,0,0,1,0,0,0,0
페미니즘 하는 한남충들 팩트)함 대달라,0,0,0,0,0,1,0,0,0,1
주변환경탓인가 어째 경상도 사람들 자신만만한 허세같은게 심한 경향이 크더라 그래도 나같은 찐따보단 나은거같음,0,0,0,1,0,0,0,0,0,0
홍위병이랑 똑같이 이제 지들이랑 반대 의견 내비치면 적으로 모네 ㅋㅋㅋㅋ 페미위키 가보니까 진보마초의 전형적인 사례일 뿐이다. 이러고 있네 ㅋㅋㅋㅋ,0,0,0,0,0,0,1,0,0,0
비정규직의 여성노동자들의 삶이 이렇게 열악합니다 힘내세요 당신들을 응원합니다 화이팅!,0,0,0,0,0,0,0,1,0,0
"부부로서 더는 함께 성장할 수 없어""..?????? 무슨 괴변이지? 부부는 검은머리가 빠뿌리가 되도록 함께 이 세상 끝날까지 함께 하는 게 기본이고, 결혼 선서에서 다 그렇게 하는데~~~",0,0,0,0,0,0,0,1,0,0
빠꾸없네ㅋㅋㅋ,0,0,0,0,0,0,1,0,0,0
보나마나 울산 공업단지에 일하러온 홍어지 이새끼들은 좆족 마냥 돈은 한국에서 벌면서 분탕질은 좆나게 해대고 온갖 범죄는 다 일으킴 이제 민증 지역번호 사라져서 좆됐다,0,1,0,1,0,0,0,0,0,0
난 심플함이 좋아서 프라다 좋아함지갑도 클러치도 프라다씀,0,0,0,0,0,0,0,1,0,0
한국인도 아닌새끼들이 무슨 나라일을 보는 공무원이야,0,1,0,0,0,0,0,0,0,0
러시아가 인종차별 제일 없는 동네다. 첨에는 스킨헤드다 뭐다 말많았는데. 러시아 조폭단이 거의 동양계잡종이라서 스킨헤드 인종차별하다 잡히면 콘크리트 담근다. 그래서 스킨헤드놈들이 다음타겟으로 게이놈들 족치는거다.,1,0,0,0,0,0,0,0,0,0
개독+동성애 난리부르스...,1,0,0,0,1,0,0,0,0,0
무슨 명목으로 정규직화 하라는건가? 하이패스로 인원자체가 필요없을텐데 비정규 정규를 논하려면 우선은 그 업무가 존속한다는 전재가 깔려야 하는거 아닌가?,0,0,0,0,0,0,0,1,0,0
민주화운동 당했네,0,0,0,0,0,0,0,1,0,0
