문장,성소수자,인종국적,연령,지역,종교,기타혐오,악플욕설,clean,개인지칭,성별
그러면 좆국이 웜련들의 보지놀이터가 될 것이다.,0,1,0,0,0,0,0,0,0,1
자세히좀써라 자칭 전문직이라는 게이가 글이 이게 뭐냐?인상찌푸려지네,0,0,0,0,0,0,1,0,0,0
말없이 진료만 하는 의사 out,0,0,0,0,0,0,1,0,0,0
정말이지 이 나라가 뭔가를 하긴하는데.. 왜이리 속는 기분일까나 누구를 위한 우쭈쭈우쭈쭈 뒤에  보이지 않는 거대한 재갈장전,0,0,0,0,0,0,0,1,0,0
세상에 여자들 상대로 장사하면서 여자 까는 심보는 뭐노?,0,0,0,0,0,0,1,0,0,0
똥꼬충이노ㅋㅋㅋㅋㅋ,1,0,0,0,0,0,0,0,0,0
아니 시발 불체자새끼들을 왜 ㅡㅡ,0,1,0,0,0,0,0,0,0,0
어려서부터보고 배운 그들만의성문화라서,0,0,0,0,0,0,0,1,0,0
퍄 ㅋㅋㅋ꾸러기노,0,0,0,0,0,0,0,1,0,0
"진짜 가지가지한다. 여자는 치마, 남자는 바지 이게 자연스러운 그림인걸 왜 자꾸 우겨대냐",0,0,0,0,0,0,0,0,0,1
저 117위 드립은 누가 만든건지... 쟤들이 말하는 페미니즘은 여성우월이죠 군인이랑 경찰 자리도 반씩 내놓으라는데 할말이 없음,0,0,0,0,0,0,0,0,0,1
노래 좃같아요,0,0,0,0,0,0,1,0,0,0
지역 어디냐 인천은 아니지? 인천맘충이 꼭 그지랄 떨더라,0,0,0,1,0,0,0,0,0,1
알았노 일단 지금은 잠 좀 자고 내일 일어나서 이미지 박제 열심히 해놓겠노,0,0,0,0,0,0,0,1,0,0
서검사님..말씀이 옳습니다~,0,0,0,0,0,0,0,1,0,0
과메기 맛있지~~ ㅋㅋ 어차피 판매하는것들은 다 냉동 된거임 ㅋㅋㅋㅋㅋㅋ 다 작년꺼 파는거 ㅋㅋ,0,0,0,0,0,0,0,1,0,0
존나 추억돋네 된장녀 ㅋㅋㅋㅋㅋㅋㅋ 요즘은 김치녀 한녀 이래서,0,0,0,0,0,0,0,0,0,1
아하 고맙다이기 지금 알아보는중인데 들어가보니 불법이라고 다 삭제된쀼젤. . 한번더갔다와야겠노 광광,0,0,0,0,0,0,0,1,0,0
오늘부터 갓대중 센세라고 불러라.,0,0,0,0,0,0,0,1,0,0
이건 교육당국문제가 아니여,0,0,0,0,0,0,0,1,0,0
고담대구 마지막 스테이지인가.,0,0,0,1,0,0,0,0,0,0
아들도 연루된건 아닌지 조사해봐야죠죠죠,0,0,0,0,0,0,0,1,0,0
쌀국 아이티계에 한남 많노? 아이티계라 한남 많을까봐 망설여지노,0,0,0,0,0,0,0,0,0,1
아주 파블로프의 개처럼 반응하네,0,0,0,0,0,0,1,0,0,0
손톱은 이쁘네.,0,0,0,0,0,0,0,1,0,0
풉킥 얌전히 도태될것이지 발광하노. 마 빻은 와꾸,0,0,0,0,0,0,1,0,0,0
전부다 에이즈로 죽어버리면남은여자들 다내꺼임 ㅋㅋㅋㅋㅋㅋㅋㅋㅋㅋㅋㅋㅋㅋㅋㅋㅋㅋㅋㅋㅋ,1,0,0,0,0,0,0,0,0,0
"저분 최소 ""힙(Hip)합(合) 목사""- 벌겋게 달아오른 십자가로 스님의 순결한 염주구멍을 꿰어버렸소..",0,0,0,0,1,0,0,0,0,0
둘이 결혼할듯,0,0,0,0,0,0,0,1,0,0
콘서트 끝나면 영상 전체 다운 받아놔야 겠다.,0,0,0,0,0,0,0,1,0,0
둘이 전쟁해서 인구 1/10로 줄면 좋겠당,0,0,0,0,0,0,0,1,0,0
동성애를 둘러싼 가짜 인권이 난무합니다 ㅠ,1,0,0,0,0,0,0,0,0,0
ㅋㅋ31처럼 제육볶음같은 상황도 발생하고 예를들어 중국집가서 요리하나 나눠먹을때도 그렇다 웜련들은 비교적 좋은환경에서 지내는것 같아 다행이노ㅋㅋ,0,0,0,0,0,0,0,1,0,0
냄져들 다 백치아다다에 글 읽기 쓰기 개빻았는데 무슨 작가질? 군대 힘 다 바질때까지 짱박아두고 노예처럼 쓰는게 답,0,0,0,0,0,0,0,0,0,1
알바도 근무 시간에 저러다간 잘리는 곳이 수두룩 한데사스가 내놔국의 후손은 목이 티타늄 합금인가 잘리지도 않네,0,0,0,0,0,0,1,0,0,0
한남은 진짜 재기가 답이다,0,0,0,0,0,0,0,0,0,1
벌레로 중요부위 가린건 첨보네,0,0,0,0,0,0,0,1,0,0
2012년이면 썩은물인데아이디 샀나봄,0,0,0,0,0,0,0,1,0,0
관잦묻었노 ^느^ 너련주변 자댕이들 다폐암으로 뒤지노 애비는 무병단수,0,0,0,0,0,0,0,0,0,1
"기도합니다 이또한, 잘 되어지길.. 기대합니다 잘 세워지길..",0,0,0,0,0,0,0,1,0,0
내 사촌동생 지방 사는데 모의고사 영어60에 반에서 일등이다 참고로 시럽계아니다 인문개다. 근데 농어촌전형으로 대학 쉽게 갈수있음 ^오^,0,0,0,0,0,0,0,1,0,0
난 오줌싸고 꼬츄 휴지로 닦음,0,0,0,0,0,0,0,1,0,0
ㅇㅇ 맞아 그리고 폐지줍는거 보다 덜힘들고 수익 그나마 나아 댓글 하나당 20원 게시물은50원,0,0,0,0,0,0,0,1,0,0
중동권에 가면 오체불만족 아시안 창녀들이 많다는데 트루?,0,1,0,0,0,0,0,0,0,1
ㅋㅋㅋㅋㅋㅋㅋㅋㅋㅋㅋㅋㅋㅋ신박하네,0,0,0,0,0,0,0,1,0,0
남자들 책 안 읽는 거 티 내네 베스트셀러 글에 좋아요 좀 눌렀다고 이렇게 화낼 일이냐ㅋㅋㅋ,0,0,0,0,0,0,0,0,0,1
아니 시발킹도 있고 맘도 있는데 왜 지랄인지 모르겠다버거퀸이 있으면 '버거는 여자만 만들라는 건가요??'맘스터치 있으니 '음식은 여자가 만들어야 한다는 성역할을 강요하는거 아닌가요?'뭘 해도 자기 뜻대로 해석가능한 기적의 논리 ㅋㅋ,0,0,0,0,0,0,0,0,0,1
저런것도 마누라랍시고 설거지 결혼한 유부충 한남들이 선택한 결과임.누구를 원망할것도 없음,0,0,0,0,0,0,0,0,0,1
맨날 좌음으로 온다이기,0,0,0,0,0,0,0,1,0,0
저런건 배워야된다,0,0,0,0,0,0,0,1,0,0
범죄자들 도피처가 목사 전도사 되는길. 신원조회하면 전과자비율이 제일 높은 직업군이 개신교일거다,0,0,0,0,1,0,0,0,0,0
화이팅이다 씨발련들,0,0,0,0,0,0,1,0,0,0
흑마술사는 ㅇㅊ,0,0,0,0,0,0,0,1,0,0
잘했어씨발 개독예수쟁이들은 다 처맞아야해아물논 정상적으로 기도하시는 분들 예외,0,0,0,0,1,0,0,0,0,0
틀딱새끼들 톡방주작하냐?,0,0,1,0,0,0,0,0,0,0
아니 시발 내가 지금 재취업을 못하고 있는데 개씨팔 난민새끼들이 어디서..,0,1,0,0,0,0,0,0,0,0
이 작성자님은...메모가 되있는 분인데.. 요즘 왔다갔다 하시네... 노선을 확실하게 하세요,0,0,0,0,0,0,0,1,0,0
김치년들 성형할꺼면 저래하든가 무슨 씨발 사진 찍어도 나오는? 또렷한 이목구비?? 이딴걸 고료해서 좆병신 자발적 성괴되고 있어 미친년들,0,0,0,0,0,0,0,0,0,1
짱깨에 의존하는 경제는 그래서 없애야됨,0,1,0,0,0,0,0,0,0,0
여자80퍼센트 뽑는날 와야 하노,0,0,0,0,0,0,0,1,0,0
짤 ㅅㅌㅊ,0,0,0,0,0,0,0,1,0,0
한남똥꼬충은 댕청해서 안됨ㅋ,0,0,0,0,0,0,0,0,0,1
ㅋㅋㅋㅋㅋㅋㅋㅋㅋㅋㅋㅋㅋㅋㅋㅋㅋㅋㅋㅋㅋㅋㅋㅋㅋㅋㅋㅋㅋㅋㅋㅋㅋㅋㅋㅋㅋㅋㅋㅋㅋ브금,0,0,0,0,0,0,1,0,0,0
제발진짜 제발 보냈으면 좋겠다제발이다 제발,0,0,0,0,0,0,0,1,0,0
목사가 저러니 저런목사로부터 가르침을 받는 신도들은 안봐도 비디오다.,0,0,0,0,1,0,0,0,0,0
저 새끼들은 학습능력이없나,0,0,0,0,0,0,1,0,0,0
건강한 예배 회복을 위해 함께 기도하겠습니다~,0,0,0,0,0,0,0,1,0,0
나 핵교다닐때 저거 나눠만주고 나중에 안쓴다고 2주만에 걷어감,0,0,0,0,0,0,0,1,0,0
커뮤도 하고 웜도 해라 봊대로 해라이기,0,0,0,0,0,0,0,1,0,0
20일 서한이 이제 공개되는 이유는 누군가가 SK케미컬 주식을 샀기때문인가,0,0,0,0,0,0,0,1,0,0
기다리던 놈이 나타나 정답을 주노,0,0,0,0,0,0,0,1,0,0
"vloopup, pivot, macro도 다 하는 엑셀충인데 f4는 첨 들어본다 ㅋㅋ 이게 머라고?",0,0,0,0,0,0,0,1,0,0
한남들은 외국에서 학부졸업했으면 거기서 정착할 여건도 충분히 되지않노 ?? 유학파로 인정받고싶어서 굳이 기어들어온다 하지만 보지들은 집의 지원도 없이 워홀나가서 외국에서 박사함,0,0,0,0,0,0,0,0,0,1
노렸노존나 웃기네 ㅋㅋㅋ,0,0,0,0,0,0,0,1,0,0
굳이 여자화장실 쓰고 싶어서 안달난것 봐라 역겨운 젠신병자 새끼들; 범죄자새끼들 뒤져,1,0,0,0,0,1,0,0,0,0
웜련 되어있길래 그래 내가 웜련이다! 하고 머피소 가입했었노 낄낄,0,0,0,0,0,0,0,1,0,0
미신은 섬기는 귀신의 종류가 무엇이든 간에 미신에 현혹되지 않을 정도로 이성적이고 합리적인 이 세상의 모든 선량한 인류들에게 고통과 피해만을 안겨주는 정신병이고 암덩어리와도 같다 칼로 도려내 불태워야 마땅함,0,0,0,0,1,0,0,0,0,0
헐 우리 마누라 닮았는데;;,0,0,0,0,0,0,0,1,0,0
감사합니다 진정으로 대한민국의 미래를 생각해주시는 의원님이네요ㅜㅜ 응원하겠습니다,0,0,0,0,0,0,0,1,0,0
참 별... ㅡㅡ,0,0,0,0,0,0,0,1,0,0
"세금도 안내는것들이, 나랏돈은 젤많이 축네네~ 그것도%~하나님팔이로",0,0,0,0,1,0,0,0,0,0
저것들 뭐냐 대체.,0,0,0,0,0,0,1,0,0,0
전라도에 저런 경찰이 있다니 믿을수 없다. 거긴 섬인데,0,0,0,1,0,0,0,0,0,0
50살인데 한명도 없음,0,0,0,0,0,0,0,1,0,0
와 시발 진짜 세상 좆같이 돌아가네 어휴 씨발욕밖에 안나온닺진짜,0,0,0,0,0,0,1,0,0,0
목사님을 통하여 더 화합하고 단단하게 세워질 한국교회 기대하겠습니다.,0,0,0,0,0,0,0,1,0,0
저런애들은 무슬림 못되는거아니냐?,0,0,0,0,0,0,0,1,0,0
네다음여중생피떡갈비~네다음부산문재인지지율1위~네다음임금수준최하위머구~,0,0,0,1,0,0,0,0,0,0
맞노. 당연한건데 그땐 왜 몰랐지? 하고 스쳐지나가는 일이 많다이기.,0,0,0,0,0,0,0,1,0,0
오묘메 미친뇬들^^; 까벗겨도 뭐없는 뇬들이 꼭 즈지랄이야 미친 ㅋㅋ 박원순인 저게 뭐 대단한 축제라구 저걸 지지한대 말만 하지말구 퍼레이드 트럭이나 좀 바까바바봉고가 웬 지랄이야 증말 ^^;,1,0,0,0,0,0,0,0,1,0
나는 페미를 혐오한다 메갈쿵쾅이 멧퉤지년들 꺼져라,0,0,0,0,0,0,0,0,0,1
연관된것들은 우리쪽 의석수 줄어드는 한이 있더라도 모조리 날려버려야한다 우리가 남이가는 왜구들이나 외치는거지,0,1,0,0,0,0,0,0,0,0
맘충들 믹서기에 갈아넣고 싶노,0,0,0,0,0,0,0,0,0,1
목사되려면 뭐부터 시작하면되냐?,0,0,0,0,0,0,0,1,0,0
유일한 이자스민 업적(?)이라고 해야 하나?,0,0,0,0,0,0,0,1,0,0
돈크라이 듓 유아러 스트롱맨 개터졌놐ㅋㅋㅋㅋ,0,0,0,0,0,0,0,1,0,0
젠더 이슈 없다면서 20대 여성 세명 앉혀놓고 주변에 그런 20대 남성 없다고 하네; 투표 조작이라도 했다는건가 결과가 있는데,0,0,0,0,0,0,0,1,0,0
일본냄저가 죽인 여자보다 한남이 죽인 여자가 훨씬 많다. 오래 여자를 짓밟고 노예처럼 부리고 폭행 살해해온 좆병신은 한남인데 애먼 일본을 보지들까지 싸잡아 욕하고 부랄이노,0,0,0,0,0,0,0,0,0,1
근데 저거 공개하기전에6만명한테다 통보함? 개궁금하네ㅋㅋㅋㅋㅋ,0,0,0,0,0,0,0,1,0,0
역시 부산이 최고다부산 화이팅,0,0,0,0,0,0,0,1,0,0
진따새끼는 세종대왕 컴백해도 찐,0,0,0,0,0,0,1,0,0,0
폭동이야?,0,0,0,0,0,0,0,1,0,0
인민 사상검증도 아니고 충격적이다 좆같은 세상,0,0,0,0,0,0,1,0,0,0
성고재기 후장에 철근 박혔다는거 드립인 줄 알았노,0,0,0,0,0,0,1,0,1,0
우리 틀니충들도 건강틀니딱딱당 만들어라이기야,0,0,1,0,0,0,0,0,0,0
중국동포는 씨발 중국 짱깨지. 그좋은 중국 놔두고 왜 우리나라 와서 지랄들이냐.,0,1,0,0,0,0,0,0,0,0
한국교회가 먼저 선한 영향력으로 세상의 빛이되어 하나님의 영광이 되길 기도합니다,0,0,0,0,0,0,0,1,0,0
그래서 열심히 공부해서 직업이라도 업그레이드 시키려고 한다..,0,0,0,0,0,0,0,1,0,0
"개슬람이 미개해도 남녀관 하나는 본받아야한다. 여자는 순종적이여야 하고 방탕하지않으며, 문란하면 때려죽임",0,1,0,0,1,0,0,0,0,1
실제 투쟁보다 좆같이 허망한 약속을 믿은 것 그뿐이노,0,0,0,0,0,0,1,0,0,0
위아래 정하려고 애쓰는미개함은 인도인과 동급,0,1,0,0,0,0,0,0,0,0
꿀팁이노 그럼 칼은 빤쓰안에 넣어둬야겠노,0,0,0,0,0,0,0,1,0,0
부산시발개씹촌놈새끼들 냄새난다 ㅠㅠ,0,0,0,1,0,0,0,0,0,0
리뷰이벤트 입싸할께요,0,0,0,0,0,0,1,0,0,0
나에 부모 어린 자식들 이웃.주변 사람들에 생명을 위협하는 테러범 들입니다.자신들이 무슨짓을 하고 있는지 모르는 싸이코 패스 입니다.엄벌에 처해 주세요...이런짓은 살인이나 마찬 가지입니다.,0,0,0,0,0,0,1,0,0,0
성형은 기본인가 보네 일단 저딴 마인드부류의 탈북자는 내쫓자 그게 저들을 위해서도 좋을 것 아니냐?,0,1,0,0,0,0,0,0,0,0
앱충재기 빌어준다이기 보험금 두둑히 챙겨라^오^,0,0,0,0,0,0,0,0,0,1
중동식 주작,0,1,0,0,0,0,0,0,0,0
종교계의 문제가 아니라 아이가진 엄마들이라면 찬성할 수가 없죠! 게다가 난민 이슬람 반대 목소리도 못내는 자국민 역차별 정책인데 대한민국 국민이면 누가 찬성한다고 그러십니까!,0,1,0,0,0,0,0,0,0,0
경찰에게 물리적 위해를 가한다 > 무전을 친다 > 출동 병력이 여경밖에 없다 >여경 10명이 현장에 나와 무전을 친다,0,0,0,0,0,0,0,0,0,1
아무 한남이나잡고 아가리찢고싶다진심,0,0,0,0,0,0,0,0,0,1
나이브 단어들으니 ㄹㅇ이노 좆팔ㅋㅋㅋㅋㅋ,0,0,0,0,0,0,1,0,0,0
나라에서 성매매를 공창 같이 합법으로 풀었다가 이제는 불법으로 전환 해야 하는 시점이다 이런 판단이 들어서 그동안 성매매 종사 했던 사람들에게 미안하니까 보조금을 준다 이러면 좀 이해가 갈 듯 한데 범죄자로 이미 만들어 놓고 보조금 주겠다는 소리가 말도 안되는 소리죠.,0,0,0,0,0,0,0,1,0,0
나련도 예전에는 대중교통에서 혼자 스트레스받았는데 쩍벌하고 앉고 개저들 어깨빵하고 다닌다 이니야~~~~,0,0,0,0,0,0,0,0,0,1
오세라비님은 페미니스트 아닙니다만 ^^;;,0,0,0,0,0,0,0,1,0,0
개인 사기업에서 본인 회사에 맞는 사람을 뽑겠다는데. 왠 ㅈㄹ 들. 여기가 공산국가냐.,0,0,0,0,0,0,1,0,0,0
1일에 3천??? 사건터지고 준거아님??? 왜 한꺼번에 몰아줬지??,0,0,0,0,0,0,0,1,0,0
나이스 ㅅㅅ,0,0,0,0,0,0,0,1,0,0
삑 합성입니다 실제로 검색하면 안나와요 여러분,0,0,0,0,0,0,0,1,0,0
좆팔 가성비 앵 나오노ㅋㅋㅋ,0,0,0,0,0,0,1,0,0,0
두부맛 ㅋㅋㅋㅋㅋㅋㅋㅋㅋ 씨발,0,0,0,0,0,0,1,0,0,0
팩트)죄 맞다,0,0,0,0,0,0,0,1,0,0
근데 좌표없냐? 좌표좀찍어줘,0,0,0,0,0,0,0,1,0,0
잘생겼다는말.... 좀만 더 생각해보면 진짜 그 말 자체로 잘 생겼다 이말이 존나 큰 칭찬같음 얼굴이 눈코입 얼굴형 끽해봐야 5미리 이내로 차이나는건데 그 차이들이 모이니까 한놈은 존재 자체로 잘 생긴게되고 한놈은 존재 자체로 못 생긴게됨 ...,0,0,0,0,0,0,0,1,0,0
미쳤노 ㄹㅇ이거 외신감 아니냐,0,0,0,0,0,0,0,1,0,0
300 벌어서 엇다 씀? 혼자 살아도 모자랄텐데,0,0,0,0,0,0,0,1,0,0
"ㄹㅇ쓰까=""나는 워마드는 아니지만~"" ""워마드는 잘못됐지만~""식의 페미니스트=개념녀돼뿟노 반대로 터프소리는 신김치녀됐다이기야",0,0,0,0,0,0,0,0,0,1
탈동성애를 고민하는분들에게 너무 희망적인 기사네요. 탈동성애를 응원합니다! 절대 가능합니다!!,1,0,0,0,0,0,0,0,0,0
와.....,0,0,0,0,0,0,0,1,0,0
지금 4-50대들 노인되면 진정한 헬게이트가 오픈되느니라,0,0,1,0,0,0,0,0,0,0
짱깨새끼들도 짱깨짓 안하면 욕 안들음,0,1,0,0,0,0,0,0,0,0
그나라가면 그나라 법을 따라야지 당연한거 아닌감 이슬람 사람들 가뜩이나 테러자들이 많은데 말이야,0,0,0,0,1,0,0,0,0,0
조지고! 부시고!,0,0,0,0,0,0,0,1,0,0
저런 서비스해주는 건 다 사람들이노. 사회에서 남자보다 여자가 직업구하기도 힘들고 더 힘든일을 많이하는데 정작 지들은 ㅎㅁ들다 앵앵대노,0,0,0,0,0,0,1,0,0,0
가게에서 카운터 보고 있는데 내 또래 미국새끼 왔길래 가격 영어로 말해 줬더니 중1이면 가능한 수준 영어 나보고 영어 잘한다고 좆나게 필요이상 호감을 보임 게이새끼 같았음,1,1,0,0,0,0,0,0,0,0
국제결혼이 답이라는 하루도 안빠지고 외치는 새끼들이 저런건 또 까네 애미뒤짐 ㅋㅋㅋㅋㅋㅋㅋㅋ,0,0,0,0,0,0,1,0,0,0
ㅋㅋㅋㅋㅋㅋㅋㅋㅋㅋㅋㅋㅋㅋㅋㅋㅋㅋㅋㅋ 천재네 저녀석들 ㅋㅋㅋ,0,0,0,0,0,0,0,1,0,0
소추 누구냐 돈고충 한마리 있나보넼ㅋㅋㅋ,1,0,0,0,0,0,0,0,0,0
급식들이라 훈방,0,0,1,0,0,0,0,0,0,0
아니 저 여자를 욕할건 없지,0,0,0,0,0,0,0,1,0,0
데스노트 갖고싶다,0,0,0,0,0,0,0,1,0,0
한남주제에 결혼하겠다니 으따 꿈도 크다,0,0,0,0,0,0,0,0,0,1
전남 보성에 광주 이씨잖아몰랐냐지금 보성에 날리도 아닌데,0,0,0,0,0,0,0,1,0,0
"성적으로 과장된 악행은 북한, 전라도 새끼들이 잘 쓰는 선동 용어임ㅋㅋ임산부 배를 갈랐네~ 여자 젖가슴을 도려냈네~ 보지에 뭘 꽂았네~",0,1,0,1,0,0,0,0,0,0
딱 10cm만 더 컸으면 좋겠다.,0,0,0,0,0,0,0,1,0,0
결말이 어캐 났나요?,0,0,0,0,0,0,0,1,0,0
백날 떠들어봐라 항문섹 한다고 없던 에이즈가 생기는게 아니라느니 이성간에도 에이즈가 생긴다느니 논점 벗어난 씹소리 하는게 게이 옹호론자들임,1,0,0,0,0,0,0,0,0,0
공중파 광고홍보 개꿀이다이기야~~~~~~깔깔깔깔,0,0,0,0,0,0,0,1,0,0
아 내 여친도 모르더라 ㅠ 근데 인서울 이과계열 졸업함 ㅠㅠㅠ 상식 ㅆㅎㅌㅊ,0,0,0,0,0,0,1,0,0,0
으휴 30 40대가 꼴통달창세대여서 그런지 애들관리도 개판이구나,0,0,1,0,0,0,0,0,0,0
암놈 키우면 보지 좀 찍어서 올려봐라,0,0,0,0,0,0,0,0,0,1
오 축구선수 전적말벅지에 그만...,0,0,0,0,0,0,1,0,0,0
연애하기 존나 쉬운대 병신아? ㅋㅋㅋ 난 그럼 뭐냐,0,0,0,0,0,0,1,0,0,0
삼륜안 ㄷㄷㄷㄷ,0,0,0,0,0,0,0,1,0,0
게임도 예방과 치료가 필요한 중독 맞는데 뭐가 문제??,0,0,0,0,0,0,0,1,0,0
등신 새끼들 아님? 조선족이란 말 자체가 조선인을 인정하는 건데 한족 새끼들 등신임.,0,1,0,0,0,0,0,0,0,0
한국남자들은 기가 너무 쎄서 문제. 전 지구적으로 제일 기쎄면서 성격 좆밥같고 못생기고 자지도작고 여자한테 배려심도없음 ㅎㅎ,0,0,0,0,0,0,0,0,0,1
병신같은 짱깨 새끼들,0,1,0,0,0,0,0,0,0,0
한남 말동무도 해주고 심심하냐?,0,0,0,0,0,0,0,0,0,1
보지에 늘 새기겠노,0,0,0,0,0,0,1,0,0,0
라도가 또!,0,0,0,1,0,0,0,0,0,0
쌍도나 라도나 시골 촌놈새끼들이기는 매한가지.. 진짜 뭔개지랄을 하면서 싸우는건 좋은데 서울로 기어올라오지마라땅끄로 밀어버리기 전에,0,0,0,1,0,0,0,0,0,0
대물취급받고 울컥하노 ㅋㅋ,0,0,0,0,0,0,0,1,0,0
잔나비가 갑자기 생각남,0,0,0,0,0,0,0,1,0,0
안되 예슬아... 그 섹히는 널 속이고 있을뿐이야.....,0,0,0,0,0,0,1,0,0,0
"세상이 변하고 급격히 변화될지라도, 십자가의 복음의 능력은 절대불변이며...모두를 살릴수있는 생명임을 다시 깨닫네요.",0,0,0,0,0,0,0,1,0,0
동성애자는 아니지만 동성애 인정한다. 그리고 성바꾸는 사람 이것도 본인 자유니깐 인정하고 이해하려고 노력한다. 근데 이건 뭐냐 그냥 억지 부리고 떼쓰는거로밖에 안보인다.  수술하고 여군 시험 봤어야지 ㅂㅅ같은 새키,1,0,0,0,0,0,0,0,0,0
똥꼬충새끼 그렇게 당당한새끼들이 자소서에 똥꼬충인건 못쓰죠?ㅋㅋㅋㅋㅋ,1,0,0,0,0,0,0,0,0,0
팬놈 맞은몸 둘다 전라도 아니냐 ㅋㅋㅋ이이제이 개꿀,0,0,0,1,0,0,0,0,0,0
양할아버지가 외할아버지임?엄마쪽 아빠야? 누가 성폭행했다는건지 모르겠네,0,0,0,0,0,0,0,1,0,0
출구? 출구리 밥조용 헤ㅇ으으윽.. 호에에에에,0,0,0,0,0,0,0,1,0,0
근데 저것도 없어질 직군이라 안타깝네요,0,0,0,0,0,0,0,1,0,0
"아니 싫은건 싫어한다고 말할줄도 알아야지, 인정 ㅇㅇ. 나는 페미들과 민주건달들이 싫음.",0,0,0,0,0,1,0,0,0,1
인종청소 함가야겠노,0,1,0,0,0,0,0,0,0,0
진정한 젠신병자면 페미니즘 할텐데 젠신이 죽어도 페미니즘이 안티 젠신이라는거 보니까 젠신은 그냥 거세당한 자지놈이노,1,0,0,0,0,1,0,0,0,0
나아닌 나 참나는 하나 둘 셋이다 자유도 평등도 사랑하는 법이다,0,0,0,0,0,0,0,1,0,0
ㄴㄴ 그건 3인칭 호칭이지,0,0,0,0,0,0,0,1,0,0
저러다가 피해자 나오면 입 싹 닫을거노 제주도 아기천사들 봊나 위험하노,0,0,0,0,0,0,0,1,0,0
52조는???,0,0,0,0,0,0,0,1,0,0
원장은 사회적 살인 혹은 사회적 성폭행 당한 셈인데.. 이에 대한 방송이나 전문가의 말이 별로 없네요 원장에 대해서 피해입힌 것은 법으로도 그다지 큰 처벌 안당하겠죠? 암울하네요,0,0,0,0,0,0,0,1,0,0
이민자들 받아 들이기 전에 한국에 동화될 놈들인지 아닌지 판별부터 좀해라요즘 돌아가는 거보면 개슬람이고 짱개고 한국에 동화되서 사회구성원으로서 공동체에 기여하면서 살려는게 아니라 한국을 지들한테 동화시키고 현지인을 정복해서 자기밑에 두려고 드는걸로 보인다,0,1,0,0,0,0,0,0,0,0
소중한 반차 ㅋㅋ,0,0,0,0,0,0,0,1,0,0
속이 후련하네 ㅋㅋ,0,0,0,0,0,0,0,1,0,0
이거 방송 때 듣고있었는데 정말 논란거리가 될만한걸 유머러스하게 잘 대처하는거보고 역시 프로라고느낌,0,0,0,0,0,0,0,1,0,0
진짜 한국남자만큼 자기자신을 잘모르는남자들이 없을거같노 주제를 정말모르고 언제나 자신을 높게평가한다익이야 자의식과잉,0,0,0,0,0,0,0,0,0,1
왜 전라도인들은 경상도사람만 전라도를 싫어한다고 착각할까,0,0,0,1,0,0,0,0,0,0
notepad.exe,0,0,0,0,0,0,0,1,0,0
어디서나 자릉내 풍긴다이기,0,0,0,0,0,0,0,0,0,1
역시 지들보다 약한 유아 폭행하는건 한녀가 세계 1등이지~ 이래놓고선 피해자인척 하는 꼴 역겹~,0,0,0,0,0,0,0,0,0,1
언론 통제 하는 나라입니다 아마 쿠알라룸프 빼고 확진자가 많을겁니다 조심하세요,0,1,0,0,0,0,0,0,0,0
요즘 한남발 주작 자료들 보면 유독 스시남이랑 조사치 바꿔치기 함 ㅋㅋㅋ 한남충들 하나같이 ㅋㅋ 세계 여러나라 중에서도 진심 스시남한테 자격지심 유독 앵나 심해 ㅋㅋㅋㅋ,0,1,0,0,0,0,0,0,0,1
태어난 아기는 진짜 혼란스럽겠다,0,0,0,0,0,0,0,1,0,0
페미는 정신병 ㅇㅇ,0,0,0,0,0,0,0,0,0,1
자들자들 어차피 한남들 클론 아니노? 누가 그려도 저 면상 그대로노,0,0,0,0,0,0,0,0,0,1
ㄹㅇ팩트다,0,0,0,0,0,0,0,1,0,0
국제사회로 가거라 중이실으면 절이 떠나야지 타국에 와서 뽕을 빼려고하노?,0,1,0,0,0,0,0,0,0,0
그럼 여자 캐릭터 다없어져야함~ 무거운거 남자가 들어도 차별이고 여자가 무거운거 들고있으면 연약한여자 드립치고 요리 여자가해도 차별이면 모든 어린이 만화에 여자 다없애면끝,0,0,0,0,0,0,0,1,0,0
막심센세 나타나서 똥꼬충 후장 꼬매주면 좋겠다 ㅋㅋ,1,0,0,0,0,0,0,0,0,0
아니 .. 죄질이 무겁다면서 왜 집유를 하는건지 모르것네요 죄질무거워 3년 집유 5년 이게 말이 되는지,0,0,0,0,0,0,0,1,0,0
형 초짜가 영어 잘하는꿀팁좀,0,0,0,0,0,0,0,1,0,0
딱 똥꼬충새끼들 수준을 보여주는거다 뭐 순수한 사랑 플라토닉이고 개지랄을 하지만 결국 관심있는건 자지 후장밖에 없고 똥꼬에 미친 정신병자새끼들임을 지들 스스로 유감없이 보여줌,1,0,0,0,0,1,0,0,0,0
ㅋㅋㅋ 일베갔는데 0렙이노,0,0,0,0,0,0,0,1,0,0
이 새기들은 그냥 서구 세계에 끼려고그런 새기들도 있다 하고 짜고 치는거 아님?,0,0,0,0,0,0,1,0,0,0
시발 용어만 다 붙이면 똑똑해보이는 줄 아네 보지들은겉멋만 존나게 들어가지고 시발 허1지웅이냐,0,0,0,0,0,0,0,0,0,1
다정한부부,0,0,0,0,0,0,0,1,0,0
포주가 전라도를 물로봤네 그쪽동네에서 포주짓하려면 투기종목 아마추어 타이틀정도는 있어야한다 사시미는 항상 차고다녀야하고,0,0,0,1,0,0,0,0,0,0
관잦도 할수있다! 정치적 명예자살남!!!^느^ 힘내라 이기야!!,0,0,0,0,0,0,0,0,0,1
ㅅㅂ 좆나 빡친다.,0,0,0,0,0,0,1,0,0,0
둘째짤까지 보는데도 암 초기증상 나타나서 스크롤 쭉내렸다,0,0,0,0,0,0,1,0,0,0
요즘 말마다 애미뒤진 붙히는것도 뵈기싫은데..진짜 저게 유쾌한거냐..?,0,0,0,0,0,0,0,1,0,0
"이제 문화가 바뀔때가 되었나보다. 대형,초대형으로 많은 군중을 동원하는 것을 자랑하던 종교,예식,장례,응원 등의 세를 과시하는 문화가 서서히 규모가 줄어가야 할듯 하다. 특히 예식이나 장례등은 평소 교류가 있던 가까운 친지등이 참석함이 옳을것으로 봄",0,0,0,0,0,0,0,1,0,0
똥꼬충이 개소리 계속 하게 할꺼냐...,1,0,0,0,0,0,0,0,0,0
동성연애는 절대 사절 변태사절!!,1,0,0,0,0,0,0,0,0,0
노잼노잼 어인정 홍어,0,0,0,1,0,0,0,0,0,0
어차피 일베망했어,0,0,0,0,0,0,0,1,0,0
근데 막심 저거는 뭔드립이냐?,0,0,0,0,0,0,0,1,0,0
자한당 암개들 아주 쑈를하네 노처녀인거자랑하냐?? 숫처녀냐? ㅅㅅ도안해봤냐??? ㅋㅋㅋㅋ,0,0,1,0,0,0,0,0,0,1
사회주의로 가는게아니라 이미 우린 공산주의임 ㅋㅋ,0,0,0,0,0,0,0,1,0,0
백퍼 그럴거다,0,0,0,0,0,0,0,1,0,0
제발 좀 다 꺼져랑,0,0,0,0,0,0,1,0,0,0
